Judul,Penulis,Link,Abstrak
Penerapan Artificial Neural Network Untuk Prediksi Energi Listrik Jangka Menengah Menggunakan Backpropagation.,"Sakhis, Badri Ainur",http://repository.its.ac.id/119006/,"Peningkatan kebutuhan energi listrik yang terus berkembang menuntut adanya sistem prediksi untuk mendukung perencanaan dan pengelolaan sumber daya energi. Penelitian ini bertujuan untuk menerapkan metode Artificial Neural Network (ANN) dengan algoritma backpropagation dalam memprediksi konsumsi energi listrik jangka menengah. Metode ini dipilih karena kemampuannya dalam menangkap pola kompleks dan hubungan non-linear dalam data historis konsumsi listrik. Oleh karena itu, penting untuk memilih metode yang tepat untuk melakukan prediksi. Untuk menguji tingkat akurasi hasil peramalan konsumsi energi listrik menggunakan perhitungan nilai Mean Absolute Error (MAE). Tujuan penelitian ini adalah menganalisis akurasi hasil peramalan dengan algoritma backpropagation. Arsitektur ANN pada penelitian ini menggunakan 36 input layer, 2 hidden layer dimana masing masing hidden layer sebanyak 10 neuron, dan 1 output layer yang merupakan total energi yang dikonsumsi. Pada penelitian ini, melakukan beberapa pengujian model dan mengatur parameter-parameter ANN setiap pengujian. Parameter tersebut meliputi banyaknya hidden layer yang digunakan, learning rate, dan epoch. Optimizer yang digunakan untuk membangun model yaitu Adaptive Moment Estimation (Adam). Hasil penelitian menyatakan bahwa dari beberapa pengujian model terdapat nilai persentase error terendah dan persentase akurasi atau valid tertinggi. Pengujian terbaik menghasilkan error sebesar 5,6%, dengan tingkat akurasi atau validasi sebesar 94,4%. Percobaan prediksi kedepannya berdasarkan input tanggal yang ditentukan menghasilkan persentase error sebesar 43% dan persentase valid sebesar 57%.=================================================================================================================================The growing demand for electrical energy requires a prediction system to support the planning and management of energy resources. This research aims to apply the Artificial Neural Network (ANN) method with the backpropagation algorithm in predicting medium-term electrical energy consumption. This method was chosen due to its ability to capture complex patterns and non-linear relationships in historical electricity consumption data. Therefore, it is important to choose the right method for prediction. To test the accuracy of electric energy consumption forecasting results using the calculation of the Mean Absolute Error (MAE) value. The purpose of this research is to analyze the accuracy of forecasting results with the backpropagation algorithm. The ANN architecture in this study uses 36 input layers, 2 hidden layers where each hidden layer is 10 neurons, and 1 output layer which is the total energy consumed. In this research, several model tests were conducted and ANN parameters were set for each test. These parameters include the number of hidden layers used, learning rate, and epoch. The optimizer used to build the model is Adaptive Moment Estimation (Adam). The results state that from several model tests there is the lowest percentage error value and the highest percentage of accuracy or validity. The best test produces an error of 5,6%, with an accuracy or validation rate of 94,4%. Future prediction experiments based on the specified date input resulted in an error percentage of 43% and a valid percentage of 57%."
Model Optimasi Gabungan Pada Manajemen Persediaan Suku Cadang Dan Perencanaan Perawatan Dengan Mempertimbangkan Ketidakpastian Kegagalan.,"Salsabila, Nabila Yuraisyah",http://repository.its.ac.id/79796/,"Suku cadang pada umumnya termasuk dalam kelompok barang kelas C, hal ini disebabkan karena biaya dan permintaan yang rendah dibandingkan dengan barang-barang lainnya. Tetapi, ketersediaan suku cadang sangat penting untukmendukung perawatan. Salah satu masalah utama dalam manajemen persediaan suku cadang adalah meminimalkan jumlah barang yang tersimpan dalam gudang dengan mengoptimalkan parameter persediaan. Teknik optimasi pada umumnya digunakan untuk menyeimbangkan biaya persediaan dan ketersediaan suku cadang. Penelitian ini mengusulkan model optimasi gabungan dari manajemen persediaan suku cadang multi-periode multi-item dan perencanaan perawatan dengan mempertimbangkan ketidakpastian kegagalan. Pertama, model Mixed Integer Nonlinear Programing (MINLP) persediaan suku cadang diformulasikan dengan kebijakan (s, S) dengan tinjauan berkala setiap T periode. Kedua, model persediaan suku cadang ini kemudian digabungkan dengan model perencanaan pemeliharaan berkala. Ketidakpastian kegagalan dimodelkan berdasarkan distribusi probabilitas normal. Pendekatan optimasi eksak akan membutuhkan waktu komputasi yang lama untuk menyelesaikan model gabungan ini dalam skala besar. Sehingga, pendekatan metaheuristik dengan Genetic Algorithm (GA) dikembangkan untuk menyelesaikan permasalahan ini dalam skala besar. Ketiga, analisis komputasi dilakukan pada beberapa contoh dan studi kasus untuk mengevaluasi efektivitas dan efisiensi pendekatan GA yang diusulkan. Berdasarkan hasil simulasi, GA dapat menyelesaikan permasalahan berskala besar. Total biaya pada contoh studi kasus dapat menurun hingga 17,9% dibandingkan dengan kebijakan awal.============================================================================================Spare parts are often considered as Class C items, because of their low cost and low demand among the stocked items, but the availability of spare parts is essential to support maintenance requirements. Optimizing inventory parameters is the main problem of spare parts management to maintain a small number of SKUs kept in a store, and optimization techniques are commonly used to balance inventory cost and spare parts availability. Thus, this research proposes a joint optimization model of single-item multi-period spare parts inventory management and planned maintenance under uncertain failures. We present a Mixed Integer Nonlinear Programming (MINLP) formulation of the inventory optimization model under (s, S) policy with T periods of the order interval. Second, we combine this formulation with the predictive maintenance interval, representing the uncertain failures under predefined distribution. Since the model is nonlinear and stochastic, it is difficult to use exact methods to tackle it. Therefore, we combine the previously introduced MINLP formulation with a metaheuristic approach to solve the problem. Lastly, we perform a computational study on some instances and a real case study to demonstrate the proposed approach’s effectiveness and efficiency. Based on the numerical experiment results, the proposed GA performs efficiently in large scale problem and the total cost of the real case study decreased by 17.9% compared to the current policy."
Sistem Deteksi Ekspresi Toileting Pada Anak Penyandang Multidisabilitas Berdasarkan Ekstraksi Fitur Menggunakan Support Vector Machine.,"Siregar, Salsabiela Khairunnisa",http://repository.its.ac.id/113488/,"Anak-anak dengan disabilitas sering menghadapi kesulitan dalam mengekspresikan keinginan mereka, termasuk saat ingin menggunakan fasilitas toilet. Hambatan ini dapat menyebabkan terjadinya masalah kesehatan ataupun masalah lainnya pada anak, seperti perilaku buang air tidak pada tempatnya. Melalui toilet training, anak akan belajar bagaimana mereka mengendalikan keinginan untuk buang air. Keberhasilan toilet training tergantung pada cara pengajaran bertahap sesuai dengan kemampuan anak. Oleh karena itu, penelitian ini bertujuan untuk menemukan parameter toileting berdasarkan ekspresi wajah anak disabilitas dengan menggunakan kamera. Kamera diposisikan di depan subjek selama kegiatan sekolah berlangsung untuk merekam perubahan ekspresi. Hasil citra akuisisi akan dipilih untuk dibuat dataset berdasarkan perubahan ekspresi yang muncul pada saat kondisi toileting. Ekstraksi fitur dilakukan dari 51 titik landmark wajah untuk mendapatkan nilai sudut, jarak, kemiringan antar titik landmark elemen wajah. Dataset TOP5 dan TOP10 dibuat menggunakan fitur-fitur dengan nilai korelasi pearson tertinggi. Proses klasifikasi menggunakan Support Vector Machine (SVM) menunjukkan bahwa model dengan dataset TOP5 mencapai akurasi tertinggi sebesar 96% dengan kombinasi parameter C=25 dan γ=0.001, menggunakan cross validation 5-folds. Model ini menunjukkan kinerja yang baik dengan nilai precision, recall, dan F1-score yang tinggi. Sistem deteksi ekspresi toileting ini memiliki beberapa kendala pada proses pengambilan data yang membutuhkan banyak pengondisian subjek. Selain itu, terdapat beberapa kesalahan klasifikasi yang perlu diatasi untuk mendapatkan hasil yang lebih baik. Untuk meningkatkan kemampuan dan generalisasi sistem dalam mendeteksi ekspresi toileting, diperlukan dilakukan penambahan jumlah dan variasi dataset dengan melibatkan subjek dari berbagai jenis disabilitas.=========================================================================================Children with disabilities often face challenges in expressing their needs, including when they wish to use toilet facilities. These barriers can lead to health issues or other problems, such as inappropriate toileting behaviors. Toilet training helps children learn to control their urges to urinate or defecate, and its success relies on gradual teaching methods tailored to the child`s abilities. Therefore, this study aims to identify toileting parameters based on the facial expressions of children with disabilities using a camera system. The camera is positioned in front of the subjects during school activities to capture expression changes. The acquired images are selected to create a dataset based on the expression changes observed during toileting events. Feature extraction is performed using 51 facial landmark points to obtain angles, distances, and inclinations between these points. TOP5 and TOP10 datasets are generated using features with the highest Pearson correlation values. The classification process using Support Vector Machine (SVM) demonstrated that the model with the TOP5 dataset achieved the highest accuracy of 96%, with parameter settings of C=25 and γ=0.001, utilizing 5-fold cross validation. This model exhibits robust performance with high precision, recall, and F1-score metrics. Despite this, the toileting expression detection system faces challenges in data collection, such as the extensive conditioning required for data collection and some misclassification errors that need to be addressed for improved results. To enhance the system`s capability and generalization in detecting toileting expressions, it is essential to increase the number and diversity of datasets by involving subjects with various types of disabilities."
Deteksi Kecacatan Perangkat Lunak Menggunakan Support Vector Machine Teroptimasi Berbasis Grey Wolf Optimizer dan Random Walk.,"Siswantoro, Muhammad Zain Fawwaz Nuruddin",http://repository.its.ac.id/118354/,"Deteksi kecacatan perangkat lunak merupakan proses penting dalam pengembangan perangkat lunak untuk mengidentifikasi sebagai bug sehingga aplikasi dapat berfungsi tanpa kesalahan. Namun, proses ini sering memakan biaya dan waktu. Penelitian ini mengusulkan penggunaan Support Vector Machine (SVM) yang hyperparameter-nya dioptimasi menggunakan Grey Wolf Optimizer (GWO) yang dipadukan dengan Random Walk (RW). Selain itu penelitian ini juga menggunakan Principal Component Analysis (PCA) sebagai pengurangan dimensi fitur dan juga oversampling dengan Synthetic Minority Over-sampling Technique (SMOTE) untuk menyeimbangkan dataset. Hasil dari penelitian ini menunjukan bahwa GWO yang dipadukan dengan RW mampu meningkatkan akurasi SVM dalam mengklasifikasi deteksi kecacatan perangkat lunak dibandingkan dengan optimasi lain, dengan akurasi berkisar antara 76,26% - 98,21% dan rata-rata akurasi 87,03% pada berbagai dataset, sehingga membuktikan efektivitasnya dalam deteksi kecacatan perangkat lunak.=================================================================================================================================Software defect detection is an important process in software development to identify as a bug so that the application can function without errors. However, this process is often costly and time consuming. This study proposes the use of Support Vector Machine (SVM) whose hyperparameters are optimized using Grey Wolf Optimizer (GWO) combined with Random Walk (RW). In addition, this study also uses Principal Component Analysis (PCA) as a feature dimension reduction and also oversampling with Synthetic Minority Over-sampling Technique (SMOTE) to balance the dataset. The results of this study show that GWO combined with RW is able to increase the accuracy of SVM in classifying software defect detection compared to other optimizations, with an accuracy ranging from 76.26% - 98.21% and an average accuracy of 87.03% on various datasets, thus proving its effectiveness in software defect detection."
SEGMENTASI DAN EKSTRAKSI CIRI CITRA SEL DARAH PUTIH UNTUK KLASIFIKASI LEUKEMIA AKUT.,"Siti Fatonah, Nenden",http://repository.its.ac.id/77972/,"Penyakit leukemia adalah penyakit yang sangat berbahaya dan mematikan. Penyakit leukemia disebabkan oleh gagalnya kematangan sel-sel yang dihasilkan oleh sumsum tulang dan menyebar keseluruh tubuh. Perhitungan dan analisa sel darah putih saat ini hanya bisa dilakukan oleh ahli hematologi atau dokter di laboratorium dan hasil diagnosa bersifat subyektif berdasarkan pengalaman dokter. Perhitungan dan analisa sel darah putih secara otomatis sangat diperlukan agar lebih mudah dalam membantu dokter melakukan diagnosa penyakit misalnya leukemia. Leukemia akut merupakan penyakit leukemia yang paling banyak diderita pasien. Pengembangan sistem deteksi jenis leukemia akut secara otomatis berdasarkan citra mikroskopis dibagi menjadi tiga tahapan yaitu segmentasi sel darah putih, ekstraksi ciri sel darah putih, dan klasifikasi. Kendala pertama pada segmentasi sel darah putih adalah variasi staining (pewarnaan) pada citra mikroskopis sel darah sehingga perlu metode segmentasi yang bisa menangani permasalahan tersebut. Kendala kedua adalah segmentasi multi sel darah putih yaitu adanya sel-sel yang bersentuhan sehingga perlu dikembangkan metode pemisahan sel yang lebih baik agar perhitungan jumlah sel serta hasil ekstraksi ciri lebih akurat untuk proses klasifikasi. Metode pemisahan sel-sel bersentuhan yang sudah dilakukan penelitian-penelitian sebelumnya masih terkendala adanya oversegmen, undersegmen, dan estimasi kontur sel darah putih yang kurang akurat.Penelitian ini mengusulkan perbaikan metode segmentasi sel darah putih dan melakukan ekstraksi ciri pada citra mikroskopik sel darah untuk klasifikasi jenis leukemia akut. Untuk mendapatkan hasil klasifikasi yang akurat, metode segmentasi sel darah putih yang dikembangkan harus mendapatkan area sel darah putih dengan baik khususnya sel-sel yang bersentuhan sehingga pada tahapan ekstraksi ciri dapat menghasilkan ciri yang merepresentasikan karakteristik sel darah putih dengan baik. Tahapan segmentasi sel darah putih meliputi segmentasi area sel darah putih yaitu area nukleus dan sitoplasma, deteksi sel bersentuhan dan perhitungan jumlah sel, serta estimasi kontur hasil pemisahan sel yang bersentuhan. Sedangkan tahapan ekstraksi ciri adalah ekstraksi ciri warna, bentuk, dan tekstur pada area nukleus dan sitoplasma sel darah putih. Tahapan terakhir melakukan klasifikasi untuk mendapatkan jenis leukemia akut Acute Lymphocytic Leukemia (ALL) yang mempunyai tiga tipe yaitu L1, L2, dan L3. Dataset yang digunakan adalah data pada citra mikroskopis apusan darah tepi ALL yang disediakan oleh Labati, dkk dan dikumpulkan oleh pakar di Pusat Penelitian Tettamanti, Tettamanti Research. Serta menggunakan data citra bone marrow jenis Acute Lymphocytic Leukemia (ALL) dan Acute Myelotic Leukemia (AML) dari RSUD Dr. Soetomo Surabaya. Dari hasil ujicoba yang sudah dilakukan menunjukkan metode segmentasi sel darah putih yang diusulkan meliputi deteksi sel bersentuhan dan estimasi kontur single sel lebih baik dibandingkan metode sebelumnya. Metode segmentasi sel darah putih yang diusulkan kemudian digunakan untuk klasifikasi jenis ALL menghasilkan sensitivitas yang lebih tinggi dibandingkan metode lainnya."
Prediksi Drop Pressure Dan Over Pressure Pada Jaringan Pipa Distribusi Gas Bumi Menggunakan Machine Learning.,"Supriatna, Reza Yudistira",http://repository.its.ac.id/117602/,"Menjaga stabilitas distribusi gas bumi sangat penting untuk memastikan pasokan energi yang dapat diandalkan dan mendukung tujuan energi yang berkelanjutan. Pemantauan dan simulasi secara real time sangat penting untuk mengelola gangguan pasokan sehingga menyebabkan fluktuasi tekanan yang dapat membahayakan jika tidak segera ditangani, serta dapat menyebabkan penurunan produksi sehingga berdampak kepada revenue perusahaan dan risiko keselamatan pada peralatan. Kondisi tekanan over pressure dapat mendorong sistem untuk melampaui batas operasional yang aman, sehingga mengancam infrastruktur dan personel yang berada di sekitar peralatan. Menstabilkan jaringan distribusi tidak hanya mengatasi masalah keselamatan tetapi juga meningkatkan efisiensi energi, mengurangi limbah, dan mendukung upaya keberlanjutan. Studi ini mengevaluasi empat model prediktif ARIMAX, SARIMAX, random forest regression, dan linear regression untuk mengurangi risiko dan meningkatkan pengambilan keputusan operasional dalam distribusi gas alam. Model-model tersebut dinilai dengan menggunakan metrik kinerja utama, termasuk Mean Squared Error (MSE), Root Mean Squared Error (RMSE), Mean Absolute Error (MAE), dan Mean Absolute Percentage Error (MAPE), untuk mengidentifikasi metode yang paling akurat dan dapat diandalkan untuk prediksi waktu nyata. Mengingat risiko operasional dan keuangan yang terkait dengan ketidakseimbangan pasokan, memilih model prediksi yang tepat sangat penting untuk menjaga stabilitas jaringan dan meminimalkan potensi kerugian. Temuan ini menunjukkan bahwa random forest regression memberikan akurasi tertinggi dalam pengujian di dunia nyata dimana memiliki nilai MAPE 2.264, menjadikannya model yang paling cocok untuk memprediksi fluktuasi tekanan yang kompleks. Sebaliknya, linear regression kurang efektif karena variabilitasnya yang lebih tinggi ketika menangani kompleksitas manajemen tekanan memiliki nilai MAPE sebesar 31.714. Pada akhirnya, memilih model prediktif yang tepat adalah kunci untuk memastikan stabilitas jaringan, mengurangi risiko, dan mempromosikan praktik energi yang berkelanjutan."
Entity Matching Menggunakan Large Language Model dan Knowledge Graph untuk Mencari Redundansi Fitur dalam Software Specification.,"Syaifudin, Mohamad Fahmi",http://repository.its.ac.id/117535/,"Dalam Software Development Lifecycle (SDLC), berbagai dokumentasi software pendukung dihasilkan, salah satunya adalah dokumen software specification, yang berisi deskripsi fitur yang dibangun. Permasalahan umum dalam pengembangan software adalah munculnya requirement baru yang mirip dengan fungsionalitas modul yang sudah ada. Masalah ini dapat diatasi dengan memanfaatkan entity matching (EM) untuk mendeteksi redundansi antar fitur dalam software atau modul yang berbeda. EM bertujuan untuk menentukan apakah dua entitas yang berbeda mengacu pada entitas yang sama. Pendekatan EM tradisional umumnya menggunakan rule-based, deep learning, atau machine learning. Penelitian ini mengusulkan pendekatan entity matching menggunakan Large Language Model (LLM) dan Knowledge Graph (KG). Dataset yang digunakan dalam penelitian ini antara lain dari dokumen panduan user Odoo, dokumen panduan Zoho Commerce, dan dokumen public user requirement. Entitas dan relasi diekstrak dan dirubah kedalam dimensi vector melalui proses knowledge embedding. Neo4j digunakan untuk menyimpan KG dan memanfaatkan vektor index mencari entitas atau relasi yang relevan untuk EM. Penelitian ini menggunakan metode sentence-based dan graph-based dalam EM. Sentence-based matching memiliki F1-score 0.762, lebih tinggi dibandingkan metode graph-based dengan F1-score maksimum 0.471. Namun, graph-based matching unggul pada Mean Reciprocal Rank dengan nilai 0.660 dibandingkan sentence-based yang hanya 0.477. Keunggulan lain dari graph-based adalah ketidakbergantungannya pada jenis word embedding, yang ditunjukkan oleh konsistensi F1-score dalam rentang 0.4 sampai 0.5 untuk berbagai variasi model embedding.==============================================================================================================================In the Software Development Lifecycle (SDLC), various supporting software documentation is produced, one of which is the software specification document that contains a description of the features being developed. A common issue in software development is the emergence of new requirements that are similar to the functionalities of existing modules. This can be addressed by leveraging entity matching (EM) to identify redundancies between features in different software or modules. EM aims to determine whether two different entities refer to the same entity. Traditional EM approaches generally use rule-based, deep learning, or machine learning methods. This study proposes an entity matching approach using a Large Language Model (LLM) and a Knowledge Graph (KG). The datasets used in this research include user guide documents from Odoo, Zoho Commerce user guide documents, and public user requirement documents. Entities and relationships are extracted and transformed into vector dimensions through a knowledge embedding process. Neo4j is used to store the KG and to utilize vector indexing for finding relevant entities or relationships for EM. This research employs both sentence-based and graph-based methods in EM. Sentence-based matching achieved an F1-score of 0.762, which is higher than the graph-based method with a maximum F1-score of 0.471. However, graph-based matching outperformed in Mean Reciprocal Rank (MRR) with a score of 0.660 compared to 0.477 for the sentence-based approach. Another advantage of the graph-based method is its independence from the type of word embedding, as indicated by the consistent F1-score range of 0.4 to 0.5 across various embedding model variations."
Prediksi Tipe Kepribadian Berdasaran Myers-Briggs Type Indicator Menggunakan Metode Klasifikasi Kolmogorov-Arnold Networks.,"Syamsudin, Afifah Nur Sabrina",http://repository.its.ac.id/117237/,"Pembahasan mengenai prediksi tipe kepribadian di media sosial telah meningkat pesat dalam beberapa tahun terakhir. Salah satu tes kepribadian yang ramai diperbincangkan adalah Myers-Briggs Type Indicator (MBTI). MBTI merupakan sebuah metode penilaian kepribadian yang mengklasifikasikan individu ke dalam salah satu dari 16 tipe kepribadian berdasarkan empat dimensi utama: Ekstroversi-Introversi, Sensing-Intuition, Thinking-Feeling, dan Judging-Perceiving. Terdapat banyak cara dalam memprediksi kepribadian seseorang salah satunya melalui analisis tipe kepribadian berdasarkan tulisan di media sosial, metode yang umum digunakan melibatkan beberapa tahapan analisis teks dan pemrosesan bahasa. Pada penelitian ini akan dipelajari proses dan kinerja dari model klasifikasi KAN. Metode klasifikasi baru ini diharapkan dapat digunakan sebagai cara untuk mengkategorikan teks ke dalam tipe kepribadian yang sesuai. Hasil dari penelitian ini nantinya diharapkan dapat mengetahui penggunaan kata pada unggahan media sosial terhadap tipe kepribadian seseorang serta kinerja model klasifikasi dalam mengenali tipe kepribadian berdasarkan aktivitas media sosial. Hasil dari uji coba pada implementasi metode KAN mendapatkan akurasi data uji senilai 0,2545.===================================================================================================================================Discussions about personality type prediction on social media have increased rapidly in recent years. One of the most discussed personality tests is the Myers-Briggs Type Indicator (MBTI). MBTI is a personality assessment method that classifies individuals into one of 16 personality types based on four main dimensions: Extroversion-Introversion, Sensing-Intuition, Thinking-Feeling, and Judging-Perceiving. There are many ways to predict a person's personality, one of which is through analyzing personality types based on social media posts, a commonly used method involving several stages of text analysis and language processing. In this research, the process and performance of the KAN classification model will be explained. This new classification method is expected to be used to categorize text into the appropriate personality type. The results of this research are expected to determine the use of words in social media posts on a person's personality type and the performance of the classification model in recognizing personality types based on social media activities. The results of the trial on the KAN method show that the implementation gets a test data metric accuracy of 0.2545."
