Judul,Penulis,Link,Abstrak
Optimizing The Pricing of Egrek Merah Putih's Blade with Different Materials Qualities Using Responsive Pricing Strategy.,"Pribadi, Riski Puteri",http://repository.its.ac.id/108309/,"Indonesia's palm oil production significantly contributes to the country's GDP, with a volume of 46.50 million tons and an area of 15.380.981 ha in 2022, making it the world's top producer. However, Indonesia faces challenges in palm oil agriculture, particularly during harvesting. These challenges include difficulty determining fruit ripeness and quality material preferences, leading to a tendency to import harvesting sickle blades from abroad. To overcome these issues, innovative solution like the development of Egrek Merah Putih's blade from Institut Teknologi Sepuluh Nopember offers two quality materials: regular (Japanese Spring Steel) and premium (High-Speed Steel). To compete in the market, strategic pricing decisions based on a responsive pricing strategy are critical, balancing quality differences against market uncertainties influenced by quality valuation and reservation value. The research constructs a profit maximization model for Egrek Merah Putih's blades, considering reservation value and quality valuation in a responsive pricing strategy. The model includes demand, profitability, and constraint functions for regular and premium blades. Parameters include market demand, overall quality valuation, reservation value, customer Willingness to Pay (WTP), production costs, and percentage multiplier of customer Willingness to Pay (WTP). In the obtained data of 6245 demands, the optimal regular blade’s selling price is Rp225.000 with a profit of Rp27.231.105. The optimal premium blade’s selling price is Rp450.000 with a profit of Rp461.113.372. Quality valuation measures customer satisfaction with quality, while reservation value is the minimum price for a basic product. As quality valuation increases, premium blade demand and profit rise while regular blade demand and profit decline. As reservation value increases, regular blade demand and profit increase proportionally. With both increasing, overall demand and profit for both blades improve, with premium blade contributing more profit due to higher prices and quality preferences. The highest profit occurs at maximum quality valuation and maximum reservation value.=================================================================================================================================Produksi minyak sawit Indonesia memberikan kontribusi signifikan terhadap PDB negara, dengan volume sebesar 46,50 juta ton dan luas wilayah 15.380.981 ha pada tahun 2022, menjadikannya produsen terbesar dunia. Namun, Indonesia menghadapi tantangan dalam pertanian kelapa sawit, khususnya pada saat panen. Tantangan tersebut antara lain sulitnya menentukan kematangan buah dan preferensi kualitas bahan sehingga menimbulkan kecenderungan untuk mengimpor bilah dari luar negeri. Untuk mengatasi permasalahan tersebut, solusi inovatif seperti pengembangan bilah Egrek Merah Putih dari Institut Teknologi Sepuluh Nopember menawarkan dua material berkualitas: reguler (Japanese Spring Steel) dan premium (High-Speed Steel). Untuk bersaing di pasar, keputusan penetapan harga strategis berdasarkan strategi penetapan harga yang responsif sangat penting, menyeimbangkan perbedaan kualitas dengan ketidakpastian pasar yang dipengaruhi oleh penilaian kualitas dan nilai reservasi. Penelitian ini membangun model memaksimalkan keuntungan bilah Egrek Merah Putih dengan mempertimbangkan nilai reservasi dan penilaian kualitas dalam strategi penetapan harga yang responsif. Model ini mencakup fungsi permintaan, profitabilitas, dan kendala untuk bilah reguler dan premium. Parameternya meliputi permintaan pasar, penilaian kualitas secara keseluruhan, nilai reservasi, Willingness to Pay (WTP) pelanggan, biaya produksi, dan persentase pengali Willingness to Pay (WTP) pelanggan. Pada data permintaan 6245 yang diperoleh, harga jual bilah reguler optimal adalah Rp225.000 dengan keuntungan Rp27.231.105. Harga jual bilah premium optimal sebesar Rp450.000 dengan keuntungan sebesar Rp461.113.372. Penilaian kualitas mengukur kepuasan pelanggan terhadap kualitas, sedangkan nilai reservasi adalah harga minimum untuk suatu produk dasar. Ketika penilaian kualitas meningkat, permintaan dan keuntungan bilah premium meningkat sementara permintaan dan keuntungan bilah reguler menurun. Ketika nilai reservasi meningkat, permintaan dan keuntungan bilah reguler meningkat secara proporsional. Dengan meningkatkan keduanya, keseluruhan permintaan dan keuntungan untuk kedua bilah meningkat dengan bilah premium memberikan kontribusi keuntungan lebih besar karena harga dan preferensi kualitas yang lebih tinggi. Keuntungan tertinggi terjadi pada penilaian kualitas maksimum dan nilai reservasi maksimum."
Reidentifikasi Orang Pada Data Visible-Infrared Yang Terkorupsi Menggunakan Klasifier Vision Transformer.,"Pusaka, Nathanael Tenno Phileo Wong",http://repository.its.ac.id/111951/,"Teknik Reidentifikasi orang, yaitu mengidentifikasi kembali individu berdasarkan data gambar atau video yang telah ada. Dalam era modern, Reidentifikasi menjadi penting di bidang keamanan dan pemantauan. Dataset RegDB-C berisi gambar tampak dan infrared dari berba gai individu. Vision Transformer (ViT) merupakan arsitektur jaringan saraf yang efektif dalam memproses data visual-infrared, terutama saat data tersebut terkorupsi.Penilitian ini berfokus untuk mengidentifikasi orang pada berbagai kondisi pencahayaan, perubahan cahaya yang ek strim, perubahan suhu, data yang terkena noise pada data Visible-infrred dengan menggunakan dataset RegDB-C yang terdiri dari 2.060 citra visible dan 2.060 cintra infrared.Meskipun terda pat permasalahan berupa dataset yang mengalami korupsi, Vision Transformer dapat mengiden tifikasi individu secara akurat.Penilitian ini menggunakan berbagai konfigurasi model Vision Transformer, dengan pengujian menggunakan batchsize 16, 32, 64, dan modifikasi hyperpa rameter seperti learning rate dan loss function.Hasil yang didapatkan tertinggi pada Vision Transformer yang telah dimodifikasi hyperparameter dengan nilai MAP (mean Average Pre cision) yang didapatkan yaitu senilai 0,436899, dengan Rank@1 senilai :0.396440 , Rank@5 senilai 0.601942,dan Rank@10 senilai 0.702265.Penilitian ini diharapkan dapat berkontribusi dalam mengembangkan sistem reidentifikasi pada data visible-infrared yang terkorupsi meng gunakan klasifer Vision Transformer.====================================================================================================Person Reidentification techniques involve re-identifying individuals based on existing image or video data. In the modern era, reidentification has become crucial in the fields of security and monitoring. The RegDB-C dataset contains visible and infrared images of various individ uals. Vision Transformer (ViT) is a neural network architecture that is effective in processing visual-infrared data, especially when the data is corrupted. This research focuses on identifying people under various lighting conditions, extreme light changes, temperature variations, and noise in the visible-infrared data using the RegDB-C dataset, which consists of 2,060 visible images and 2,060 infrared images. Despite issues such as data corruption, Vision Transformer can accurately identify individuals. This study employs various configurations of the Vision Transformer model, testing with batch sizes of 16, 32, and 64, and modifying hyperparameters such as learning rate and loss function. The highest results were obtained with the Vision Trans former model that had modified hyperparameters, achieving a mean Average Precision (MAP) of 0.436899, with Rank@1 of 0.396440, Rank@5 of 0.601942, and Rank@10 of 0.702265. This research is expected to contribute to the development of reidentification systems for corrupted visible-infrared data using Vision Transformer classifiers."
Analisis Sentimen Pengguna Aplikasi Shopee Pada Situs Google Play Store Menggunakan Metode Support Vector Machine.,"Putra, Fahmi Maulutfi Dwi",http://repository.its.ac.id/103742/,"Marketplace adalah tempat jual beli online dimana penjual baru menerima uangnya jika barang sudah sampai ke pembeli, sedangkan E-Commerce adalah transaksi jual beli atau perdagangan secara online. Salah satu marketplace yang sangat diminati saat ini dikalangan remaja hingga dewasa adalah Shopee. Shopee resmi diperkenalkan di Indonesia pada Desember 2015 dibawah naungan PT Shopee International Indonesia. Shopee adalah sebuah aplikasi yang bergerak dibidang jual beli secara online dan dapat diakses secara mudah dengan menggunakan smartphone. Shopee merupakan aplikasi jual beli elektronik yang dapat diunduh di situs Google Play. Google Play Store memiliki berbagai macam fitur, salah satunya adalah ulasan atau opini. Ulasan atau opini ini digunakan untuk para pengguna menilai sebuah aplikasi. Pengguna aplikasi Shopee dapat memberikan opini yang berisi tanggapan, apresiasi, kritik dan masukan pada aplikasi Shopee yang tersedia di Google Play Store. Opini pada aplikasi Shopee dapat digunakan untuk mendapatkan informasi sebagai bahan perbaikan atau pengembangan aplikasi sehingga pengguna mendapatkan kepuasan. Proses pengembangan membutuhkan opini dari pengguna, hal tersebut bisa didapat dari data opini pada Google Play Store dalam bentuk data teskstual. Data tekstual tersebut bisa dianalisis menggunakan text mining. Banyak metode yang dapat digunakan untuk memudahkan proses klasifikasi sentiment data, setiap metode memiliki karakteristik berbeda sehingga tingkat keefektifan setiap metode berbeda-beda. Dalam menganalisis opini dibutuhkan metode yang cepat dan akurat yaitu analisis sentimen dengan metode Support Vector Machine (SVM). Hasil penelitian menunjukkan bahwa untuk analisis sentimen dengan kategori sentimen positif yaitu sebesar sebesar 53,13%, sedangkan untuk opini pengguna aplikasi Shopee berdasarkan kategori sentimen negatif sebesar 46,87% dengan hasil nilai accuracy sebesar 64,5%, nilai sensitivity sebesar 60,1%, dan nilai specificity sebesar 69,5%.=================================================================================================================================Marketplace is a place for buying and selling online where sellers only receive money if the goods have reached the buyer, while E-Commerce is buying and selling or trading transactions online. One of the marketplaces that is in great demand today among teenagers to adults is Shopee. Shopee was officially introduced in Indonesia in December 2015 under the auspices of PT Shopee International Indonesia. Shopee is an application engaged in buying and selling online and can be accessed easily using a smartphone. Shopee is an electronic buying and selling application that can be downloaded on the Google Play site. The Google Play Store has various features, one of which is reviews or opinions. These reviews or opinions are used for users to rate an application. Shopee application users can provide opinions that contain responses, appreciation, criticism and input on the Shopee application which is available on the Google Play Store. Opinions on the Shopee application can be used to obtain information as material for improvement or application development so that users get satisfaction. The development process requires opinions from users, this can be obtained from opinion data on the Google Play Store in the form of textual data. The textual data can be analyzed using text mining. Many methods can be used to facilitate the sentiment data classification process, each method has different characteristics so that the level of effectiveness of each method varies. In analyzing opinions, a fast and accurate method is needed, namely sentiment analysis using the Support Vector Machine (SVM) method. The results showed that for sentiment analysis the positive sentiment category was 53.13%, while for the opinion of Shopee application users based on the negative sentiment category it was 46.87% with an accuracy value of 64.5%, a sensitivity value of 60.1%, and a specificity value of 69.5%."
Implementasi IndoBERT Dalam Analisis Sentimen Berita Untuk Prediksi Harga Saham PT. Bank Rakyat Indonesia Tbk. Menggunakan Pendekatan Support Vector Regression.,"Putra, Ferdyansyah Permana",http://repository.its.ac.id/105901/,"Fluktuasi harga saham sering dipengaruhi oleh berbagai faktor, dan salah satunya adalah sentimen, yang dapat berasal dari masyarakat umum atau berita terkait saham. Harga saham PT. Bank Rakyat Indonesia Tbk. (BBRI), sebagai salah satu dari ""big four"" bank terbesar di Indonesia, juga dapat dipengaruhi oleh sentimen ini. Dalam usaha untuk meramalkan harga penutupan saham BBRI berdasarkan sentimen berita, penelitian ini mengadopsi pendekatan machine learning dengan menggunakan metode Support Vector Regression (SVR) dan mengoptimalkan fungsi dengan algoritma Fruit Fly Optimization Algorithm (FOA). Sentimen dievaluasi terlebih dahulu dengan metode IndoBERT. Penelitian ini mengusulkan beberapa model, termasuk model tanpa memperhitungkan sentimen, model dengan mempertimbangkan sentimen pada periode ke t, model dengan mempertimbangkan sentimen pada periode ke t-1, dan model dengan mempertimbangkan sentimen pada periode ke t dan periode ke t-1. Analisis hasil sentimen menggunakan IndoBERT menunjukkan tingkat akurasi sentimen secara keseluruhan di atas 90%. Selain itu, hasil pemodelan menunjukkan bahwa model terbaik menggunakan SVR adalah model yang tidak mempertimbangkan sentimen, dengan nilai error peramalan yaitu Mean Average Percentage Error (MAPE) lebih rendah dibandingkan dengan model lain. Hasil peramalan dengan dari model terbaik menunjukkan bahwa data aktual masih berada dalam interval kepercayaan 95% dari hasil ramalan, sehingga menunjukkan relevansi ramalan dengan data aktual.=================================================================================================================================Fluctuations in stock prices are often influenced by various factors, and one of them is sentiment, which can originate from the general public or stock-related news. The stock price of PT. Bank Rakyat Indonesia Tbk. (BBRI), as one of the ""big four"" largest banks in Indonesia, can also be influenced by this sentiment. In an effort to forecast the closing price of BBRI stock based on news sentiment, this research adopts a machine learning approach using the Support Vector Regression (SVR) method and optimizes the function with the Fruit Fly Optimization Algorithm (FOA). Sentiment is first evaluated using the IndoBERT method. This research proposes several models, including a model without considering sentiment, a model considering sentiment on the day of the event, a model considering sentiment on the previous day, and a model considering sentiment on both the day of the event and the previous day. Sentiment analysis results using IndoBERT show an overall accuracy rate above 90%. Furthermore, modelling results indicate that the best-performing SVR model is the one that does not consider sentiment, with a lower Mean Average Percentage Error (MAPE) compared to other models. The forecasting results from the best model show that the actual data still falls within the 95% confidence interval of the forecast, demonstrating the relevance of the forecast to the actual data."
Optimasi Model Klasifikasi Multi-Label Berbahasa Indonesia: Penerapan dan Perbandingan Metode Bi-LSTM dan BERT pada Teks Berita Berbahasa Indonesia.,"Putra, Marsyavero Charisyah",http://repository.its.ac.id/111093/,"Pengguna internet di Indonesia terus meningkat setiap tahunnya. Pada tahun 2023, survei APJII mencatat 78,19% populasi Indonesia menggunakan internet, meningkat 2,67% dari tahun sebelumnya. Peningkatan ini mendorong pertumbuhan media online dan mengubah cara masyarakat mengakses berita dari media cetak ke online. Dengan bertambahnya pengguna internet, volume berita online juga meningkat signifikan. Diperlukan teknik efisien untuk mengelola dan mengklasifikasikan berita agar memudahkan pengguna memahami informasi yang relevan. Penelitian ini mengembangkan model multilabel classification menggunakan Bi-LSTM dan BERT serta membandingkan performanya dengan model dari penelitian sebelumnya. Dataset berasal dari scraping teks berita dari detik.com dan Petakabar, dijadikan satu dataset bernama Topic Mining. Dataset dilabeli secara manual dengan 39 label. Empat model dikembangkan: Bi-LSTM, Bi-LSTM dengan Attention, BERT, dan Hybrid (kombinasi BERT dan Bi-LSTM dengan Attention). Evaluasi kinerja model menggunakan metrik F1-Score, akurasi, recall, dan hamming loss. Model Hybrid menunjukkan performa terbaik dengan mean recall 0,864, mean F1-score 0,893, mean accuracy 0,981, dan mean Hamming Loss 0,019. Label yang berperforma terbaik adalah ""bencana"" dengan F1-score 0,973, sedangkan label yang berperforma terburuk adalah ""politik"" dengan F1-score 0,279.==============================================================================================================================The number of internet users in Indonesia continues to increase every year. In 2023, a survey by APJII recorded that 78.19% of Indonesia's population uses the internet, an increase of 2.67% from the previous year. This growth has driven the rapid expansion of online media and changed the way people access news from print to online. With more internet users, the volume of online news has also increased significantly. Efficient techniques are needed to manage and classify news to help users understand relevant information. This study developed a multi-label classification model using Bi-LSTM and BERT and compared its performance with the previous model from the previous research. The dataset, named Topic Mining, was created by scraping news texts from detik.com and Petakabar. The dataset was manually labeled with 39 labels. Four models were developed: Bi-LSTM, Bi-LSTM with Attention, BERT, and Hybrid (a combination of BERT and Bi-LSTM with Attention). Model performance was evaluated using F1-Score, accuracy, recall, and hamming loss. The Hybrid model showed the best performance with a mean recall of 0,864, a mean F1-score of 0,893, a mean accuracy of 0,981, and a mean hamming loss of 0,019. With the best-performing label is ""disaster"" with an F1-score of 0,973, while the worst performing label is ""politics"" with an F1-score of 0,279."
Sistem Informasi Geografis Berbasis Google Earth API Menggunakan Algoritma K-Nearest Neighbors.,"Putra, Nicky Permana",http://repository.its.ac.id/81664/,"Sistem Informasi Geografis merupakan sistem komputer yang memiliki kemampuan untuk membangun, menyimpan, mengelola dan menampilkan informasi berupa peta geografis suatu daerah. Sistem Informasi Geogafis ini akan digunakan untuk melakukan pengelompokan statistik – statistik daerah dan dikelompokkan pada kategori yang ada untuk kemudian ditampilkan dalam bentuk peta tematik atau peta digital menggunakan algoritma K-Nearest Neighbor. Data – data statistik yang nantinya akan dimasukkan dapat berupa data tingkat kemiskinan, data tingkat pengangguran dari suatu daerah, dll. Algoritma K-NN akan mengelompokkan data sesuai kategori dan saat data-data tersebut sudah terkelompokkan maka peta akan muncul dengan daerah yang sudah diberi warna dimana daerah-daerah tersebut sudah tergolongkan sesuai dengan kategorinya. Hal ini dapat diterapkan di pemerintahan guna untuk mempermudah dalam pengambilan kebijakan dalam suatu daerah"
