Judul,Penulis,Link,Abstrak
Identifikasi  dan Klasifikasi  Tingkat Ketidakseimbangan Statis Sela Udara Motor Induksi Berbasis Transformasi Wavelet Arus Stator.,"Mualim, Latif",http://repository.its.ac.id/82331/,"Tugas akhir ini membahas tentang pengidentifikasian dan klasifikasi ketidakseimbangan sela udara pada motor induksi dengan menggunakan transformasi wavelet diskrit yang mana dari wavelet ini diambil nilai statistik dari level tertentu komponen transformasi wavelet untuk dijadikan nilai input pada analisa jaringan saraf tiruan. Dengan memanfaatkan nntool pada MATLAB dibuatlah neuron network dengan input berupa 12 nilai statistik dan target data berupa kondisi motor. Neuron network yang sudah di training menggunakan data arus yang diukur pada tugas akhir ini. Hasilnya adalah neuron network mampu mengidentifikasi dan mengklasifikasi data arus untuk mengetahui keadaan motor tetapi terbatas hanya pada motor induksi yang digunakan pada tugas akhir ini karena keterbatasan data arus dari motor lain =====================================================================================================This final project discusses the identification and classification of airgap eccentricity in induction motors using discrete wavelet transforms, from which the statistical values of certain levels of wavelet transform components are taken to be used as input values in the analysis of artificial neural networks. By utilizing nntool in MATLAB, a neuron network was created with input in the form of 12 statistical values and target data in the form of motor conditions. Neuron networks that have been trained use current data measured in this final project. The result is that the neuron network is able to identify and classify current data of induction motor but it is limited to the induction motor used in this final project due to the limitation of current data from other motors."
Rancang Bangun Sistem Elektronik untuk Menyimak dan Mengetes Hafalan Al-Quran Berbasis Arabic Speech to Text dan Metode Levenshtein Distance.,"Muayyad, Ahmad Saad",http://repository.its.ac.id/87298/,"Al-Quran merupakan kitab suci agama Islam yang secara luas dibaca, dihafalkan, dipelajari, dan diajarkan oleh para pemeluknya. Indonesia merupakan negara dengan pemeluk agama Islam terbanyak di dunia, maka jumlah institusi dimana Al-Quran itu dihafal dan diajarkan juga sangat banyak. Berdasarkan hal tersebut, pada Tugas Akhir ini telah dibuat sebuah sistem untuk menyimak dan mengetes hafalan Al-Quran. Sistem ini menggunakan Arabic Speech-to-Text untuk mengubah input suara menjadi teks bahasa Arab, yang kemudian dibandingkan dengan data teks Al-Quran menggunakan metode Levenshtein Distance. Bila nilai perbandingan antara input dan data teks yang tersimpan melewati batas dan logika yang sudah didesain, maka sistem akan memberikan peringatan melalui output berupa suara dan tampilan visual. Sistem yang dirancang diimplementasikan menggunakan Raspberry Pi 3B+ yang dilengkapi dengan microphone, buzzer, dan Touch Screen Display. Sistem elektronik ini menggunakan data Al-Quran yang diinput secara manual dan data Al-Quran dari PyQuran sebagai rujukan. Dihasilkan persentase error sebesar 0,45% untuk penggunaan data manual dan 3,52% untuk penggunaan data PyQuran dalam pengujian 3 halaman di juz pertama Al-Quran. Latency rata-rata yang dihasilkan untuk satu kata yang diproses dengan kecepatan internet 10 Mbps adalah 0,1292 s. Kedepannya, kualitas sistem koreksi dapat ditambahkan terutama untuk PyQuran agar sistem elektronik ini dapat digunakan untuk 30 juz Al-Quran secara lengkap sehingga dapat membantu para penghafal Al-Quran =====================================================================================================Al-Quran is Islam’s Holy Book that widely recited, memorized, studied, and taught by its followers. Indonesia is a country with the largest number of Muslim, in which many intitutions where Al-Quran are memorized and taught. Based on that, in this Final Project, an electronic system for correcting and testing Al-Quran memorization was designed. This system uses Arabic Speech-to-Text to convert audio input to Arabic text that was compared to Al-Quran text data with Levenshtein Distance Method. If the comparison value between audio input and Al-Quran text data exceeds the limit and logic that has been designed, the system will give a warning by audio and visual output. This system is designed using Raspberry Pi 3B+ equipped with microphone, buzzer, and Touch Screen Display. This electronic system uses Al-Quran data that manually input and PyQuran data as its reference. An error percentage of 0,45% was obtained using Al-Quran manual data and 3,52% was obtained using PyQuran data for 3 pages from the first juz testing. Average latency that was obtained for each word processing for 10 Mbps internet speed is 0,1292 s. In the future research, the quality of correction system can be upgraded especially for PyQuran so this system can be used for 30 juz perfectly and will be a huge benefit for Al-Quran memorizer."
Prediksi Financial Distress Perusahaan Sektor Industri di Indonesia dengan Metode Klasifikasi dan Melibatkan Synthetic Features Generation.,"Muda, Muhammad Adlansyah",http://repository.its.ac.id/83474/,"Masalah kondisi financial distress dapat berakhir dengan kebangkrutan apabila tidak segera ditanggulangi. Untuk mengantisipasi dan meminimalisir dampak dari bangkrutnya suatu perusahaan terutama pada sektor industri, maka dilakukan prediksi financial distress untuk menilai kondisi keuangan perusahaan dan perspektif masa depannya. Pada penelitian ini prediksi financial distress dilakukan dengan metode klasifikasi seperti Generalized Extreme Value Regression, Logistic Regression, Support Vector Machine, dan Extreme Gradient Boosting dengan melibatkan synthetic features generation secara serentak dan seleksi variabel. Berdasarkan nilai accuracy, AUC, dan F1-score dari hasil evaluasi model menggunakan data testing didapatkan bahwa metode synthetic features generation tidak selalu memberikan performansi klasifikasi terbaik pada tiap size. Pada size 0 dan size 1 disimpulkan bahwa model Extreme Gradient Boosting dengan melibatkan synthetic features generation dan seleksi variabel merupakan model dengan performansi klasifikasi terbaik, sedangkan pada size 2 dan size 3 didapatkan bahwa model Extreme Gradient Boosting tanpa melibatkan synthetic features generation dengan seleksi variabel merupakan model dengan performansi klasifikasi terbaik dalam memprediksi kondisi keuangan perusahaan sektor industri di Indonesia.====================================================================================================================The problem of financial distress can lead to bankruptcy if it is not addressed immediately. To anticipate and minimize the impact of a company bankruptcy, especially in the industrial sector, financial distress predictions are made to assess the company’s financial condition and its future perspective. In this study, prediction of financial distress is carried out using classification methods such as Generalized Extreme Value Regression, Logistic Regression, Support Vector Machine, and Extreme Gradient Boosting by involving synthetic features generation simultaneously and variable selection. Based on the accuracy, AUC, and F1-score from the results of model evaluation using data testing, it is found that the synthetic features generation method does not always provide the best classification performance for each size. At size 0 and size 1, it can be concluded that the Extreme Gradient Boosting model involving synthetic features generation with variable selection is the model with the best classification performance, whereas at size 2 and size 3, it is found that the Extreme Gradient Boosting model without involving synthetic features generation with variabel selection is the model with the best classification performance in predicting the financial condition of industrial sector companies in Indonesia."
Secure Indoor Positioning System Model Menggunakan Serangan Boundary Attack Berbasis Aplikasi Mobile.,"Muhammad, Banabil Fawazaim",http://repository.its.ac.id/106076/,"Selama dekade terakhir, perangkat seluler telah berevolusi tidak hanya berfungsi sebagai komunikasi jarak jauh, namun juga sebagai perangkat navigasi menggunakan Global Positioning System (GPS). Karena keterbatasan GPS dalam ruangan, dikembangkan IPS (Indoor Positioning System) sebagai pengganti dari GPS pada saat di dalam ruangan.  Studi ini menyoroti kurangnya perhatian terhadap keamanan dan privasi dalam pengembangan IPS, terutama dalam menghadapi serangan keamanan seperti serangan Boundary Attack.  Penelitian ini bertujuan untuk membuat IPS yang tahan terhadap serangan Boundary Attack dengan mengembangkan model menggunakan data sidik jari Channel State Information (CSI).  Tujuan dari penelitian ini mencakup membandingkan kinerja antara model IPS dan model rekan terhadap serangan serangan perimeter, dan mengintegrasikan model dengan aplikasi seluler untuk menampilkan lokasi pengguna secara real time. Metode penelitiannya antara lain mengumpulkan dataset dari Tower 2 ITS, membangun dan melatih model IPS menggunakan data yang diserang dan tidak diserang, menerapkan serangan Boundary Attack, dan membuat aplikasi seluler terintegrasi.  Hasil penelitian meliputi evaluasi akurasi model sebelum dan sesudah serangan serta perbandingan dengan model pembanding dalam kondisi serangan. Model IPS berhasil dibangun yang dapat menahan serangan Boundary Attack dan menjaga akurasi bahkan setelah serangan tersebut. Membandingkan model IPS dengan model pembanding menunjukkan ketahanan yang baik terhadap serangan.  Dengan mengintegrasikan aplikasi mobile dengan IPS melalui Flask, pengguna dapat melihat lokasinya dengan akurasi tinggi dan real time.=================================================================================================================================Over the past decade, mobile devices have evolved to function not only as long-distance communication, but also as navigation devices using the Global Positioning System (GPS). Due to the limitations of indoor GPS, IPS (Indoor Positioning System) was developed as a replacement for GPS when indoors. This study highlights the lack of attention to security and privacy in the development of IPS, especially in the face of security attacks such as Boundary Attack. This research aims to create an IPS that is resistant to Boundary Attack by developing a model using Channel State Information (CSI) fingerprint data. The objectives of this research include comparing the performance between the IPS model and the peer model against perimeter attack attacks, and integrating the model with a mobile application to display the user's location in real time. The research methods included collecting datasets from Tower 2 ITS, building and training the IPS model using attacked and unattacked data, applying the Boundary Attack, and creating an integrated mobile application. The results include an evaluation of the accuracy of the model before and after the attack as well as a comparison with the comparison model under attack conditions. An IPS model was successfully built that can withstand Boundary Attack attacks and maintain accuracy even after such attacks. Comparing the IPS model with the comparison model shows good resistance to attacks. By integrating a mobile application with the IPS through Flask, users can view their location with high accuracy and in real time."
Sistem Informasi Pengelolaan Keuangan Sekolah (Sipks) Dengan Electronic Dan Digital Signature Recognition Menggunakan Algoritma MobileNet.,"Mukhlishah, Chaniyah Zulfa",http://repository.its.ac.id/83295/,"Pengelolaan anggaran sekolah merupakan aktivitas yang sering dilakukan di berbagai Sekolah, terutama sekolah negeri. Pengelolaan anggaran pun dapat mencakup dalam berbagai hal. Seperti kegiatan penganggaran dana akademik, organisasi, maupun administrasi yang mutlak membutuhkan alokasi dana dalam pelaksanaannya. Oleh karena itu, kegiatan pengelolaan keuangan sekolah membutuhkan perhatian, terutama dalam hal teknis pelaksanaannya agar dapat diimplementasikan lebih mudah. Pada era digital saat ini, metode penganggaran dana yang manual merupakan sebuah permasalahan dimana metode manual ini sering dikhawatirkan oleh pihak sekolah dalam hal pencatatan dan keamanannya."
Aplikasi Discrete Wavelets Transform pada Analisis Regresi Spektrum Tumpang Tindih Senyawa Parasetamol dan Kafein.,"Mulyaningtias, Nadia",http://repository.its.ac.id/90046/,"Obat umumnya berisi kombinasi dari beberapa senyawa aktif. Parasetamol sering digunakan sebagai obat analgesik dan anti piretik. Kafein adalah stimulan sistem saraf pusat (SSP). Dalam pemasaran obat sakit kepala di masyarakat, pemeriksaan mutu obat diperlukan untuk menjamin bahwa obat menggandung bahan aktif dengan mutu dan jumlah sesuai dengan kandungan yang tertera pada label obat. Sehingga diperlukan metode yang efisien tanpa pemisahan, dengan bantuan spektrofotometer UV-Vis, metode Discrete Wavelets Transform dan analisis multikomponen. Sebanyak 25 larutan training set disiapkan dan dianalisis absorbansinya menggunakan metode Multiple Linier Regression, metode Support Vector Regression (SVR), metode Partial Least Square (PLS) Regression, metode AdaBoost Regression. Model yang didapat divalidasi dengan tes data sebelum diaplikasikan pada obat sakit kepala. Penentuan kadar obat yang sesuai dengan kadar dalam label obat, yaitu pada metode Support Vector Regression dimana rata-rata kadar obat prediksi parasetamol sebesar 512,5473 mg dan pada kafein sebesar 67,1091 mg. Sehingga metode berhasil digunakan untuk menetapkan kadar dalam tablet obat sakit kepala.=======================================================================================================Medicine generally contain active ingredients. Paracetamol is often used as an analgesic and anti-pyretic medicine. Caffeine is a central nervous system (CNS) stimulant. In marketing headache medicine in the community, quality inspection of medicine is needed to ensure that the medicine contains active ingredients with the quality and quantity according to the content stated on the medicine label. So an efficient method without separation is needed, with the help of a UV-Vis spectrophotometer, the Discrete Wavelets Transform method and multivariate analysis. A total of 25 training set solutions were prepared and their absorbance analyzed using the Multiple Linear Regression method, the Support Vector Regression (SVR) method, the Partial Least Square (PLS) Regression method, the AdaBoost Regression method. The model obtained was validated by testing the data before it was applied to headache medicine. Determination of medicine levels in accordance with the levels on the medicine label, namely the Support Vector Regression method where the average level of the predicted medicine parasetamol is 512.5473 mg and the caffeine is 67.1091 mg. So that the method was successfully used to determine the levels in headache medicine tablets."
Optimasi Convolutional Neural Network melalui Fungsi Aktivasi dan Inisialisasi Kernel untuk Pengenalan Tulisan Huruf Hijaiyah.,"Nasty, Khairuddin",http://repository.its.ac.id/117839/,"Penelitian ini mengoptimalkan model Convolutional Neural Network (CNN) untuk pengenalan tulisan tangan huruf Hijaiyah dengan menganalisis kombinasi fungsi aktivasi (ReLU, Leaky ReLU, Sigmoid, Tanh) dan metode inisialisasi kernel (He normal, He uniform, LeCun normal, LeCun uniform, Glorot normal, Glorot uniform). Dataset yang digunakan adalah Hossam Magdy Balaha Dataset (HMBD) yang dimodifikasi—dengan penambahan tanda baca fathah, kasrah, dan dhammah—untuk mengevaluasi 24 kombinasi parameter. Hasil eksperimen menunjukkan bahwa kombinasi He normal-ReLU mencapai performa terbaik dengan akurasi 93,84%, presisi 93,96%, recall 93,77%, dan F1-score 93,71%. Analisis konvergensi mengungkapkan kombinasi ini stabil setelah epoch ke-10, dengan validation loss di bawah 0,5, serta fluktuasi akurasi kurang dari ±1%. Kesalahan klasifikasi tertinggi terjadi pada pasangan dengan kemiripan visual, yaitu Ain fathah-Haa fathah (14,63%) yang diidentifikasi melalui confusion matrix. Konversi model ke TensorFlow Lite berhasil mengurangi ukuran dari 29,4 MB menjadi 9,8 MB (66,67%) tanpa penurunan performa, dengan akurasi tetap 93,84%. Temuan ini membuktikan bahwa optimasi inisialisasi kernel dan fungsi aktivasi secara signifikan meningkatkan akurasi dan efisiensi model, sekaligus memberikan panduan implementasi CNN untuk aplikasi mobile edukasi berbasis tulisan tangan non-Latin.==================================================================================================================================This study optimized a Convolutional Neural Network (CNN) model for recognizing handwritten Hijaiyah characters by analyzing combinations of activation functions (ReLU, Leaky ReLU, Sigmoid, Tanh) and kernel initialization methods (He normal, He uniform, LeCun normal, LeCun uniform, Glorot normal, Glorot uniform). The modified Hossam Magdy Balaha Dataset (HMBD)—augmented with diacritical marks (fathah, kasrah, dhammah)—was used to evaluate 24 parameter combinations. Experimental results demonstrated that the He normal-ReLU combination achieved the best performance, with 93.84% accuracy, 93.96% precision, 93.77% recall, and 93.71% F1-score. Convergence analysis revealed this combination stabilized after the 10th epoch, with validation loss below 0.5 and accuracy fluctuations within ±1%. The highest misclassification rate (14.63%) occurred between visually similar pairs, specifically Ain fathah-Haa fathah, as identified through confusion matrices. Model conversion to TensorFlow Lite successfully reduced its size from 29.4 MB to 9.8 MB (66.67%) without performance degradation, maintaining 93.84% accuracy. These findings prove that optimizing kernel initialization and activation functions significantly enhances model accuracy and efficiency, while providing a practical guideline for implementing CNNs in mobile-based educational applications for non-Latin handwriting recognition."
Penyaringan Surel Bersifat Spam Dengan Menggunakan Online Active Ensemble Learning.,"Naufal, Muhammad Rafif Fadhil",http://repository.its.ac.id/107850/,"Surel merupakan salah satu bentuk komunikasi yang sangat umum digunakan di seluruh dunia. Hal ini mengakibatkan traffic keluar-masuk surel yang berkembang di tiap tahunnya. Salah satu masalah yang sering terjadi pada surel adalah adanya surel yang bersifat spam. Spam merupakan surel yang tidak diinginkan oleh penerimanya dan biasanya berisi iklan, penipuan, atau konten yang tidak senonoh. Penyaringan surel merupakan salah satu upaya mewujudkan Pembangunan Berkelanjutan (SDGs). Pada Penelitian ini, akan dibuat sebuah model untuk melakukan penyaringan surel bersifat spam dengan menggunakan metode Online Active Ensemble Learning. Metode ini merupakan perpaduan antara online active learning dengan model klasifikasi ensemble. Model ini akan diimplementasikan menggunakan bahasa pemrograman Python. Dataset yang digunakan penelitian ini merupakan dataset public bernama enron-spam. Dataset ini terdiri dari kumpulan email 6 pegawai Enron. Total email yang terdapat pada dataset ini adalah 33.716 email. Hasil eksperimen menunjukkan bahwa model yang menggunakan metode Online Active Ensemble Learning memiliki performa yang lebih baik dibandingkan dengan model single learning. Hal ini ditunjukkan dengan nilai akurasi, presisi, recall, dan f1-score yang lebih tinggi. Selain itu, penggunaan resource yang dibutuhkan untuk melakukan prediksi dan learning juga lebih rendah, sehingga semakin mendukung efisiensi dan keberlanjutan. Kesimpulannya, metode Online Active Ensemble Learning dapat digunakan untuk melakukan penyaringan surel bersifat spam dengan performa yang baik dan efisien dalam penggunaan resource, sehingga turut berkontribusi terhadap pencapaian beberapa SDGs.============================================================================================================================Email is one of the most common forms of communication used worldwide, leading to a growing volume of incoming and outgoing email traffic each year. One of the recurring issues with email is the presence of spam, which refers to unwanted emails typically containing advertisements, scams, or inappropriate content. Email filtering is one approach to realizing Sustainable Development Goals (SDGs). In this research, a model will be developed to filter spam emails using the Online Active Ensemble Learning method, which combines online active learning with ensemble classification models. This model will be implemented using the Python programming language. The dataset used in this study is a public dataset called enron-spam, consisting of a collection of emails from six Enron employees totaling 33,716 emails. Experimental results indicate that the model utilizing the Online Active Ensemble Learning method outperforms single learning models, as evidenced by higher accuracy, precision, recall, and f1-score values. Additionally, the resource requirements for prediction and learning are lower, further supporting efficiency and sustainability. In conclusion, the Online Active Ensemble Learning method can be employed for effective and resource-efficient spam email filtering, thereby contributing to the achievement of several SDGs."
Segmentasi Jantung Pada Citra Short-Axis View Magnetic Resonance Imaging Menggunakan 2D U-Net.,"Nindita, Nabil Virio Akhsan",http://repository.its.ac.id/108687/,"Penyakit kardiovaskular merupakan masalah kesehatan yang signifikan secara global, menyebabkan banyak kematian, terutama disebabkan oleh penyakit jantung. Diagnosis penyakit jantung yang akurat dan tepat waktu sangat penting untuk pengobatan yang efektif. Adanya kemajuan teknologi medis telah meningkatkan pemahaman dan pengambilan tindakan terhadap penyakit tersebut. Penelitian ini berfokus pada segmentasi struktur jantung pada citra Short Axis Magnetic Resonance Imaging ( SAX MRI) menggunakan model deep learning dengan arsitektur U-Net 2D. Tujuan utama dari penelitian ini adalah untuk mengembangkan model deep learning yang dapat mensegmentasi struktur jantung, yaitu ventrikel kiri (LV), ventrikel kanan (RV), dan miokardium. Penelitian ini menggunakan dataset Automated Cardiac Diagnosis Challenge (ACDC) 2017, yang mencakup pemindaian MRI dari 150 pasien dengan berbagai kondisi jantung. Model segmentasi berbasis U-Net 2D yang diusulkan diharapkan menghasilkan akurasi tinggi, sehingga berpotensi untuk memberi manfaat bagi penanganan penyakit jantung. Berdasarkan pengujian yang telah dilakukan dari skenario-skenario penelitian didapatkan hasil Dice dan IoU Score oleh model sebesar 0,8806 dan 0,7663.=================================================================================================================================Segmentasi Cardiovascular disease is a significant health problem globally, causing many deaths , mainly caused by heart disease. Accurate and timely diagnosis of heart disease is essential for effective treatment. Advances in medical technology have improved the understanding and treatment of these diseases. This research focuses on segmenting cardiac structures in Short Axis Magnetic Resonance Imaging (SAX MRI) images using deep learning model with 2D U-Net architecture. The main objective of this research is to develop a deep learning model that can segment the heart structures, namely the left ventricle (LV), right ventricle (RV), and myocardium. This study uses the Automated Cardiac Diagnosis Challenge (ACDC) 2017 dataset, which includes MRI scans of 150 patients with various heart conditions. The proposed 2D U-Net-based segmentation model is expected to yield high accuracy, potentially benefiting the treatment of heart disease. Based on the tests that have been carried out from the scenarios of this research the Dice and IoU Score results obtained by the model are 0,8806 and 0,7663.Jantung Pada Citra Short-Axis View Magnetic Resonance Imaging Menggunakan 2d U-Net"
