Judul,Penulis,Link,Abstrak,Preprocessed_Judul,Preprocessed_Abstrak
Sistem Deteksi Android Malware Menggunakan Metode Gated Reccurent Unit (GRU) Deep Learning.,"Abidin, Zainal",http://repository.its.ac.id/99166/,"Malware merupakan perangkat lunak jahat yang dirancang dengan tujuan untuk merusak sistem device-device ( smartphone, computer, dan perangkat-perangkat lain ) korban. Penggunaan sistem operasi Android menempati urutan pertama dalam pangsa pasar. Android merupakan sistem operasi yang menggunakan kernel linux, linux merupakan sistem operasi yang open source. Sehingga dengan kondisi tersebut menyebabkan dengan lebih mudah dan lebih menguntungkan bagi pembuat malware untuk menargetkan operasi sistem yang opensource, dan pada android tidak adanya batasan pemasangan aplikasi dari sumber mana pun yang memungkinkan. Oleh karena itu diperlukan pendeteksi yang dapat mengikuti perkembangan serta menyadarkan pengguna kepeduliannya terhadap kemaanan informasi. Pada tugas akhir ini akan menggunakan dataset Android malware yang teridiri fitur permission, dataset tersebut meru pakan dataset opensource terdiri dari 2 kelas sampel ( malware dan benign) dengan total 11,975 sample (6,000 malware and 5,975 benign) dalam bentuk format file csv. Arsitektur model deep learning yang digunakan adalah arsitektur GRU .Pada penilitian tugas akhir ini akan membandingkan kinerja yang dihasilkan dari tiga optimizer yaitu adamax, radam, dan SGD. Kinerja yangdibandingkan meliputi precision , recall , f1-measure dan specitivity.==================================================================================================================================Malware is malicious software designed with the intent to damage the systems of devices such as smartphones, computers, and other equipment. Android operating systems hold the highest market share, making them a prevalent target for malware creators. As an open-source system using a Linux kernel, Android’s accessibility potentially provides more opportunities for malware developers to exploit. Moreover, Android allows applications to be installed from any source, adding to the vulnerability. Therefore, it is crucial to have detection systems that can evolve with the malware landscape and alert users to potential threats to their information security.In this research, we utilize an open-source Android malware dataset, which consist of permissions features. The dataset consists of two sample classes (malware and benign) with a total of 11,975 samples (6,000 malware and 5,975 benign), represented in a CSV file format. We employ a deep learning model architecture known as the Gated Recurrent Unit (GRU) .This research aims to compare the performance of three optimizers—adamax, radam, and Stochastic Gradient Descent (SGD)—in terms of precision, recall, F1-measure, and specificity. This com- parison aims to determine which optimizer produces the most efficient and accurate malware detection results for Android systems.",sistem deteksi android malware metode gated reccurent unit gru deep learning,malware perangkat lunak jahat rancang tuju rusak sistem devicedevice smartphone computer perangkatperangkat korban guna sistem operasi android tempat urut pangsa pasar android sistem operasi kernel linux linux sistem operasi open source kondisi sebab mudah untung buat malware target operasi sistem opensource android batas pasang aplikasi sumber deteksi ikut kembang sadar guna peduli kemaanan informasi tugas dataset android malware teridiri fitur permission dataset meru pakan dataset opensource 2 kelas sampel malware benign total 11975 sample 6000 malware and 5975 benign bentuk format file csv arsitektur model deep learning arsitektur gru penilitian tugas banding kerja hasil optimizer adamax radam sgd kerja yangdibandingkan liput precision recall f1measure specitivitymalware is malicious software designed with the intent to damage the systems of devices such as smartphones computers and other equipment android operating systems hold the highest market share making them a prevalent target for malware creators as an opensource system using a linux kernel android  s accessibility potentially provides more opportunities for malware developers to exploit moreover android allows applications to be installed from any source adding to the vulnerability therefore it is crucial to have detection systems that can evolve with the malware landscape and alert users to potential threats to their information securityin this research we utilize an opensource android malware dataset which consist of permissions features the dataset consists of two sample classes malware and benign with a total of 11975 samples 6000 malware and 5975 benign represented in a csv file format we employ a deep learning model architecture known as the gated recurrent unit gru this research aims to compare the performance of three optimizers adamax radam and stochastic gradient descent sgd in terms of precision recall f1measure and specificity this com parison aims to determine which optimizer produces the most efficient and accurate malware detection results for android systems
Klasifikasi Penyakit Berdasarkan Foto Rontgen Thorax Menggunakan Metode Support Vector Machine.,"Abiyyi, Muhammad Zuhdi Afi",http://repository.its.ac.id/98468/,"Pada tahun 2019 seluruh dunia terdampak pandemi Covid-19, Covid-19 disebabkan oleh SARS-Cov-2 yang merupakan virus jenis baru dari coronavirus atau kelompok virus yang menginfeksi sistem pernafasan. Virus ini akan memberikan dampak yang berbeda-beda pada setiap orang, mulai dari infeksi tanpa gejala, penyakit ringan seperti flu, hingga penyakit kritis seperti pneumonia, atau bahkan kematian. Keragaman ini menyebabkan para dokter khususnya spesialis paru memerlukan tindakan foto rontgen sebagai penunjang dalam proses penegakan diagnosis. Dan peningkatan jumlah pasien tidak sebanding dengan jumlah tenaga kerja yang memiliki kemampuan dalam menginterpretasikan foto rontgen, karena hanya dokter spesialis radiologi yang memiliki kemampuan tersebut, bahkan dokter spesialis paru pun belum tentu bisa menginterpretasikan foto rontgen. Penelitian Tugas Akhir ini dilakukan dengan metode principle component analysis sebagai salah satu cara dalam melakukan reduksi dimensi terhadap data yang diperoleh. Selain itu, penelitian ini juga menggunakan metode support vector machine sebagai salah satu cara dalam melakukan pengklasifikasian jenis-jenis penyakit berdasarkan foto rontgent. Model SVM terbaik yang didapatkan dari percobaan pada tugas akhir adalah model SVM dengan proporsi data 80% data training, 20% data testing, dan ukuran gambar 200x200. Model tersebut mampu menghasilkan akurasi sebesar 83.65%. Hasil dari penelitian ini diharapkan dapat membantu para tenaga medis maupun pasien dalam mengetahui atau mendiagnosis hasil foto rontgennya sedini mungkin dengan hasil yang tepat dan akurat.=================================================================================================================================In 2019 the whole world was affected by the Covid-19 pandemic, Covid-19 was caused by SARS-Cov-2 which is a new type of coronavirus or a group of viruses that infect the respiratory system. This virus will have a different impact on each person, ranging from asymptomatic infections, minor illnesses such as the flu, to critical illnesses such as pneumonia, or even death. This diversity causes doctors, especially pulmonary specialists, to require X-rays as a support in the process of making a diagnosis. And the increase in the number of patients is not proportional to the number of workers who have the ability to interpret X-rays, because only radiology specialists have this ability, even lung specialists may not necessarily be able to interpret X-rays. This Final Project research was conducted using the principle component analysis method as a way of reducing the dimensions of the data obtained. In addition, this study also used the support vector machine method as a way of classifying the types of diseases based on X-rays. The best SVM model obtained from the experiments in the final assignment is the SVM model with the proportion of data 80% training data, 20% testing data, and 200x200 image size. This model is capable of producing an accuracy of 83.65%. The results of this study are expected to assist medical personnel and patients in knowing or diagnosing X-ray results as early as possible with precise and accurate results.",klasifikasi sakit dasar foto rontgen thorax metode support vector machine,2019 dunia dampak pandemi covid19 covid19 sebab sarscov2 virus jenis coronavirus kelompok virus infeksi sistem nafas virus dampak berbedabeda orang infeksi gejala sakit ringan flu sakit kritis pneumonia mati ragam sebab dokter spesialis paru tindak foto rontgen tunjang proses tega diagnosis tingkat pasien banding tenaga kerja milik mampu interpretasi foto rontgen dokter spesialis radiologi milik mampu dokter spesialis paru interpretasi foto rontgen teliti tugas metode principle component analysis salah reduksi dimensi data oleh teliti metode support vector machine salah klasifikasi jenisjenis sakit dasar foto rontgent model svm baik dapat coba tugas model svm proporsi data 80 data training 20 data testing ukur gambar 200x200 model hasil akurasi 8365 hasil teliti harap bantu tenaga medis pasien diagnosis hasil foto rontgen din hasil akuratin 2019 the whole world was affected by the covid19 pandemic covid19 was caused by sarscov2 which is a new type of coronavirus or a group of viruses that infect the respiratory system this virus will have a different impact on each person ranging from asymptomatic infections minor illnesses such as the flu to critical illnesses such as pneumonia or even death this diversity causes doctors especially pulmonary specialists to require xrays as a support in the process of making a diagnosis and the increase in the number of patients is not proportional to the number of workers who have the ability to interpret xrays because only radiology specialists have this ability even lung specialists may not necessarily be able to interpret xrays this final project research was conducted using the principle component analysis method as a way of reducing the dimensions of the data obtained in addition this study also used the support vector machine method as a way of classifying the types of diseases based on xrays the best svm model obtained from the experiments in the final assignment is the svm model with the proportion of data 80 training data 20 testing data and 200x200 image size this model is capable of producing an accuracy of 8365 the results of this study are expected to assist medical personnel and patients in knowing or diagnosing xray results as early as possible with precise and accurate results
Analisis Sentimen Berdasar Aspek Review Kuliner dan Restoran Menggunakan Latent Dirichlet Allocation dan Support Vector Machine Untuk Meningkatkan Profitabilitas Bisnis Kuliner dan Restoran di Surabaya.,"Ajipangestu, Drajad Bima",http://repository.its.ac.id/84978/,"Makanan merupakan hal yang selalu dekat dengan kita, seiring dengan berkembangnya jumlah penduduk, bisnis kuliner dan restoran terus berkembang. Di kala Pandemi Covid-19, walaupun banyak orang yang tidak bepergian, tetapi sesekali pasti ingin membeli makanan favorit mereka di luar rumah baik itu beli langsung di tempat maupun online. Dengan semakin bertumbuhnya wisata kuliner dan restoran di Indonesia, persaingan antar pelaku bisnis tersebut semakin tinggi. Maka dari itu pada penelitian ini dilakukan analisa sentiment review pelanggan yang mereka tulis di media sosial untuk mendapatkan aspek kuliner dan restoran yang paling berpengaruh dan memiliki sentimen positif tinggi dari pelanggan di Surabaya. Penelitian ini melakukan analisis sentimen review kuliner dan restoran di Surabaya dan bertujuan untuk mendapatkan strategi peningkatkan profitabilitas restoran yang ada di Surabaya. Setiap tweet mengenai kuliner dan restoran akan dikumpulkan sebagai data dan dikategorikan menjadi empat aspek yang kami tentukan yaitu: Price, Taste, Place dan Service. Dalam penelitian ini, data Twitter akan diambil menggunakan Twitter API dan disimpan dalam format JSON. Selanjutnya, akan dilakukan preprocessing. Kemudian dilakukan kategorisasi aspek dengan menggabungkan metode Latent Dirichlet Allocation (LDA) dan semantic similarity untuk meng-kategorisasikan dokumen kedalam 4 aspek kuliner (Price, Taste, Place dan Service). Kemudian dalam menghitung Semantic Similatiry, term list akan diperluas dengan menggunakan metode Term Frequency-Inverse Cluster Frequency (TF-ICF). Setelah itu masuk ke tahap klasifikasi dengan Word Embedding untuk mengekstrak ekstraksi fitur menggunakan metode Global Vector for Word Representation (GloVe). Klasifikasi yang digunakan pada penelitian ini adalah dengan menggunakan Support Vectorc Machine (SVM) dengan 3 modifikasi parameter dari metode SVM yaitu C-SVC, SVC Linear, SVCnu dengan berbagai perubahan kernel untuk mendapatkan hasil terbaik. Analisa sentimen dalam penelitian ini akan membandingkan antara klasifikasi sentimen dengan menggunakan 3 metode perubahan SVM dan Klasifikasi tambahan menggunakan SentiCircle. Performa skenario terbaik untuk analisa sentimen akan diaplikasikan. Performa dari setiap metode dievaluasi menggunakan precision, recall dan F1-Measure. Hasil dari uji coba menunjukkan bahwa performa kategorisasi aspek tertinggi dilakukan dengan melakukan penggabungan metode Latent Dirichlet Allocation (LDA) untuk mencari hidden topic, digabungkan dengan Term Frequency-Inverse Cluster Frequency (TF-ICF) 100% untuk peluasan term dan Semantic Similarity untuk kategorisasi aspek yang mendapatkan hasil performa hingga mencapai 91% dan performa Word Embedding untuk representasi angka vector dengan GloVe dan SVM nuSVC dengan kernel RBF dan perubahan parameter nu 0.1 untuk klasifikasi sentimen mendapatkan performa mencapai 88%. Sehingga, peneliti melakukan penggabungan metode LDA+TF-ICF 100% + Semantic Similarity untuk melakukan kategorisasi aspek dan menggunakan GloVe+SVM NuSVC 0.1 untuk melakukan klasifikasi sentimen pada setiap review. Kemudian, pada evaluasi akhir yang dilakukan, peneliti mendapatkan bahwa aspek service pada kuliner dan restoran memiliki review dengan sentiment negative tinggi yang mencapai 10,869% dibanding dengan sentiment review pada aspect lainnya (price: 4.348, taste: 6.522, place: 4.521) sehingga pemilik bisnis kuliner perlu melakukan perbaikan-perbaikan untuk lebih memperhatikan pelayanan pelanggan dengan tujuan untuk mengurangi jumlah review negative pada aspect service tersebut. Hasil juga menunjukkan bahwa perubahan sentiment (pada positive atau negative sentiment) dipengaruhi oleh aspect yang dimiliki oleh setiap review. Analisa sentimen dari review terhadap aspek kuliner dan restoran dilakukan untuk membantu manajer bisnis atau pemilik usaha kuliner melakukan perbaikan layanan dalam tujuan untuk peningkatan profitabilitas restoran di Surabaya.====================================================================================================Food is something that is always close to us, along with the growing population, the culinary and restaurant business continues to grow. During the Covid-19 Pandemic, although many people don't travel, sometimes they definitely want to buy their favorite food outside the home, whether it's buying directly on the spot or online. With the growing growth of culinary tourism and restaurants in Indonesia, the competition between these business actors is getting higher. Therefore, in this study, an analysis of the customer review sentiments they wrote on social media was carried out to get the most influential culinary and restaurant aspects and have high positive sentiment from customers in Surabaya. This study analyzes the sentiment analysis of culinary and restaurant reviews in Surabaya and aims to obtain a strategy to increase the profitability of restaurants in Surabaya. Every tweet about culinary and restaurant will be collected as data and categorized into four aspects that we determine, namely: Price, Taste, Place and Service.In this study, Twitter data will be retrieved using the Twitter API and stored in JSON format. Next, preprocessing will be carried out. Then the aspect categorization is carried out by combining the Latent Dirichlet Allocation (LDA) and semantic similarity methods to categorize the document into 4 culinary aspects (Price, Taste, Place and Service). Then in calculating Semantic Similatiry, the term list will be expanded using the Term Frequency-Inverse Cluster Frequency (TF-ICF) method. After that, enter the classification stage with Word Embedding to extract feature extraction using the Global Vector for Word Representation (GloVe) method. The classification used in this study is to use the Support Vectorc Machine (SVM) with 3 modifications to the parameters of the SVM method, namely C-SVC, SVC Linear, SVCnu with various kernel changes to get the best results. Sentiment analysis in this study will compare sentiment classification using 3 methods of changing SVM and additional classification using SentiCircle. The best scenario performance for sentiment analysis will be applied.The performance of each method was evaluated using precision, recall and F1-Measure. The results of the trial show that the highest aspect categorization performance is carried out by combining the Latent Dirichlet Allocation (LDA) method to find hidden topics, combined with Term Frequency-Inverse Cluster Frequency (TF-ICF) 100% for term extension and Semantic Similarity for aspect categorization. which got performance results up to 91% and Word Embedding performance for vector number representation with GloVe and SVM nuSVC with RBF kernel and parameter changes to nu 0.1 for sentiment classification got performance reaching 88%. Thus, the researchers combined the LDA+TF-ICF 100% + Semantic Similarity method to categorize aspects and used GloVe+SVM NuSVC 0.1 to classify sentiments for each review. Then, in the final evaluation carried out, the researcher found that the service aspect in culinary and restaurant has a review with a high negative sentiment that reaches 10.869% compared to sentiment reviews on other aspects (price: 4,348, taste: 6,522, place: 4,521) so that business owners culinary needs to make improvements to pay more attention to customer service with the aim of reducing the number of negative reviews on this service aspect. The results also show that changes in sentiment (on positive or negative sentiment) are influenced by the aspect of each review. Sentiment analysis from reviews of culinary and restaurant aspects is carried out to help business managers or culinary business owners make service improvements in order to increase the profitability of restaurants in Surabaya.",analisis sentimen dasar aspek review kuliner restoran latent dirichlet allocation support vector machine tingkat profitabilitas bisnis kuliner restoran surabaya,makan iring kembang duduk bisnis kuliner restoran kembang pandemi covid19 orang pergi beli makan favorit rumah beli langsung online tumbuh wisata kuliner restoran indonesia saing laku bisnis teliti analisa sentiment review langgan tulis media sosial aspek kuliner restoran pengaruh milik sentimen positif langgan surabaya teliti analisis sentimen review kuliner restoran surabaya tuju strategi tingkat profitabilitas restoran surabaya tweet kuliner restoran kumpul data kategori aspek tentu price taste place service teliti data twitter ambil twitter api simpan format json preprocessing kategorisasi aspek gabung metode latent dirichlet allocation lda semantic similarity kategorisasi dokumen dalam 4 aspek kuliner price taste place service hitung semantic similatiry term list luas metode term frequencyinverse cluster frequency tficf masuk tahap klasifikasi word embedding ekstrak ekstraksi fitur metode global vector for word representation glove klasifikasi teliti support vectorc machine svm 3 modifikasi parameter metode svm csvc svc linear svcnu ubah kernel hasil baik analisa sentimen teliti banding klasifikasi sentimen 3 metode ubah svm klasifikasi tambah senticircle performa skenario baik analisa sentimen aplikasi performa metode evaluasi precision recall f1measure hasil uji coba performa kategorisasi aspek tinggi gabung metode latent dirichlet allocation lda cari hidden topic gabung term frequencyinverse cluster frequency tficf 100 luas term semantic similarity kategorisasi aspek hasil performa capai 91 performa word embedding representasi angka vector glove svm nusvc kernel rbf ubah parameter nu 01 klasifikasi sentimen performa capai 88 teliti gabung metode ldatficf 100 semantic similarity kategorisasi aspek glovesvm nusvc 01 klasifikasi sentimen review evaluasi teliti aspek service kuliner restoran milik review sentiment negative capai 10869 banding sentiment review aspect price 4348 taste 6522 place 4521 milik bisnis kuliner perbaikanperbaikan perhati layan langgan tuju kurang review negative aspect service hasil ubah sentiment positive negative sentiment pengaruh aspect milik review analisa sentimen review aspek kuliner restoran bantu manajer bisnis milik usaha kuliner baik layan tuju tingkat profitabilitas restoran surabayafood is something that is always close to us along with the growing population the culinary and restaurant business continues to grow during the covid19 pandemic although many people dont travel sometimes they definitely want to buy their favorite food outside the home whether its buying directly on the spot or online with the growing growth of culinary tourism and restaurants in indonesia the competition between these business actors is getting higher therefore in this study an analysis of the customer review sentiments they wrote on social media was carried out to get the most influential culinary and restaurant aspects and have high positive sentiment from customers in surabaya this study analyzes the sentiment analysis of culinary and restaurant reviews in surabaya and aims to obtain a strategy to increase the profitability of restaurants in surabaya every tweet about culinary and restaurant will be collected as data and categorized into four aspects that we determine namely price taste place and servicein this study twitter data will be retrieved using the twitter api and stored in json format next preprocessing will be carried out then the aspect categorization is carried out by combining the latent dirichlet allocation lda and semantic similarity methods to categorize the document into 4 culinary aspects price taste place and service then in calculating semantic similatiry the term list will be expanded using the term frequencyinverse cluster frequency tficf method after that enter the classification stage with word embedding to extract feature extraction using the global vector for word representation glove method the classification used in this study is to use the support vectorc machine svm with 3 modifications to the parameters of the svm method namely csvc svc linear svcnu with various kernel changes to get the best results sentiment analysis in this study will compare sentiment classification using 3 methods of changing svm and additional classification using senticircle the best scenario performance for sentiment analysis will be appliedthe performance of each method was evaluated using precision recall and f1measure the results of the trial show that the highest aspect categorization performance is carried out by combining the latent dirichlet allocation lda method to find hidden topics combined with term frequencyinverse cluster frequency tficf 100 for term extension and semantic similarity for aspect categorization which got performance results up to 91 and word embedding performance for vector number representation with glove and svm nusvc with rbf kernel and parameter changes to nu 01 for sentiment classification got performance reaching 88 thus the researchers combined the ldatficf 100 semantic similarity method to categorize aspects and used glovesvm nusvc 01 to classify sentiments for each review then in the final evaluation carried out the researcher found that the service aspect in culinary and restaurant has a review with a high negative sentiment that reaches 10869 compared to sentiment reviews on other aspects price 4348 taste 6522 place 4521 so that business owners culinary needs to make improvements to pay more attention to customer service with the aim of reducing the number of negative reviews on this service aspect the results also show that changes in sentiment on positive or negative sentiment are influenced by the aspect of each review sentiment analysis from reviews of culinary and restaurant aspects is carried out to help business managers or culinary business owners make service improvements in order to increase the profitability of restaurants in surabaya
