Judul,Penulis,Link,Abstrak,Preprocessed_Judul,Preprocessed_Abstrak
Segmentasi White Matter Hyperintensity Pada Citra MRI Otak Menggunakan U-Net.,"Fahlevi, Muhammad Hashfi",http://repository.its.ac.id/108783/,"Gray matter dan white matter adalah bagian pada otak yang memiliki fungsi yang sangat krusial dalam kerja otak. Gray matter adalah tempat di mana sel-sel saraf dan akson berada. Gray matter menempati mayoritas bagian cerebrum, cerebellum, dan batang otak. Beberapa fungsi gray matter adalah mengontrol sistem gerak manusia, pemrosesan emosi, dan ingatan. Berbeda dengan gray matter, white matter adalah bagian pada otak di mana kumpulan akson berada dan kebanyakan terletak di bagian tengah otak. Fungsi dari white matter adalah memproses dan mengirimkan sinyal ke sumsum tulang belakang. Menjadi salah satu bagian yang paling krusial pada tubuh manusia, kerusakan pada dua bagian ini tentunya dapat menyebabkan penyakit dan kelainan pada sistem saraf tubuh manusia. Salah satu kelainan yang umum terjadi adalah WMH (white matter hyperintensity), yaitu gangguan di mana intensitas white matter melebihi intensitas yang seharusnya dan menjadi salah satu tanda beberapa penyakit seperti Alzheimer dan kelainan kognitif. Dengan pencitraan MRI, bagian otak yang mengalami WMH dapat terlihat dan dianalisis untuk tindakan lebih lanjut. Salah satu cara menganalisis citra MRI adalah dengan melakukan segmentasi pada citra MRI, khususnya menggunakan arsitektur U-Net. Berdasarkan hasil percobaan, didapatkan hasil bahwa segmentasi WMH pada citra MRI dengan menggunakan arsitektur U-Net menghasilkan segmentasi yang cukup akurat.=================================================================================================================================Gray matter and white matter are parts of the brain that play crucial roles in its functioning. Gray matter is where nerve cells and axons are located. It occupies the majority of the cerebrum, cerebellum, and brainstem. Some functions of gray matter include controlling human motor systems, processing emotions, and managing memory. In contrast, white matter is the part of the brain where bundles of axons are found, mostly situated in the central regions of the brain. The function of white matter is to process and transmit signals to the spinal cord. As one of the most crucial parts of the human body, damage to these two components can lead to diseases and disorders in the human nervous system. One common disorder is white matter hyperintensity (WMH), where the intensity of white matter exceeds normal levels, serving as a sign of certain conditions such as Alzheimer’s and cognitive disorders. With MRI imaging, areas of the brain experiencing WMH can be observed and analyzed for further action. One method of analyzing MRI images is by performing segmentation, particularly using the U-Net architecture. Based on experimental results, it was found that WMH segmentation in MRI images using the U-Net architecture produces reasonably accurate segmentation.",segmentasi white matter hyperintensity citra mri otak unet,gray matter white matter otak milik fungsi krusial kerja otak gray matter selsel saraf akson gray matter tempat mayoritas cerebrum cerebellum batang otak fungsi gray matter kontrol sistem gerak manusia pemrosesan emosi ingat beda gray matter white matter otak kumpul akson banyak letak otak fungsi white matter proses kirim sinyal sumsum tulang salah krusial tubuh manusia rusa sebab sakit lain sistem saraf tubuh manusia salah lain wmh white matter hyperintensity ganggu intensitas white matter lebih intensitas salah tanda sakit alzheimer lain kognitif citra mri otak alami wmh analis tindak salah analis citra mri segmentasi citra mri arsitektur unet dasar hasil coba dapat hasil segmentasi wmh citra mri arsitektur unet hasil segmentasi akuratgray matter and white matter are parts of the brain that play crucial roles in its functioning gray matter is where nerve cells and axons are located it occupies the majority of the cerebrum cerebellum and brainstem some functions of gray matter include controlling human motor systems processing emotions and managing memory in contrast white matter is the part of the brain where bundles of axons are found mostly situated in the central regions of the brain the function of white matter is to process and transmit signals to the spinal cord as one of the most crucial parts of the human body damage to these two components can lead to diseases and disorders in the human nervous system one common disorder is white matter hyperintensity wmh where the intensity of white matter exceeds normal levels serving as a sign of certain conditions such as alzheimer  s and cognitive disorders with mri imaging areas of the brain experiencing wmh can be observed and analyzed for further action one method of analyzing mri images is by performing segmentation particularly using the unet architecture based on experimental results it was found that wmh segmentation in mri images using the unet architecture produces reasonably accurate segmentation
Penentuan Safety Integrity Level (SIL) pada Safety Instrumented System Air Compressor Berdasarkan Nilai Probability Failure on Demand (PFD) dengan Metode K-Nearest Neighbor.,"Faizah, Nova Auliyarul",http://repository.its.ac.id/115480/,"Terdapat adanya resiko berbahaya yang dapat terjadi pada air compressor, sehingga diperlukan adanya suatu sistem pengamanan. Sistem pengamanan ini dibangun untuk diimplementasikan pada air compressor, dimana sistem ini mendapat sinyal dari field berupa push button dan output dari transmitter yang terdiri dari pressure, vibration dan temperature. Kinerja dari Safety Instrumented System (SIS) dapat dilihat dari tingkat integrasi keselamatan atau Safety Integrity Level (SIL) saat menjalankan fungsinya. Parameter untuk mengetahui tingkat SIL yaitu Probability Failure on Demand (PFD) dan Risk Reduction Factor (RRF). Oleh karena itu, pada proyek akhir ini dilakukan perhitungan Safety Integrity Level pada Safety Instrumented System Air Compressor berdasarkan algoritma K-Nearest Neighbor (KNN). Klasifikasi tingkat SIL ini berdasarkan nilai PFD dan RRF yang telah dihitung sebelumnya. KNN akan mengklasifikasikan data berdasarkan ukuran kesamaan atau fungsi jarak. Metode KNN terbukti memiliki akurasi yang tinggi sebesar 100% dalam mengklasifikasikan SIL dengan proporsi perbandingan data training dan data testing sebesar 80%:20%. Dengan nilai k=6, KNN memiliki akurasi tertinggi dibandingkan dengan nilai k lainnya. Evaluasi yang dilakukan dengan membandingkan kinerja KNN dengan metode penentuan SIL lainnya, ditemukan bahwa K-NN memiliki keunggulan dalam hal efisiensi dan akurasi. Sehingga dapat disimpulkan bahwa model KNN menawarkan solusi yang lebih baik dan praktis dalam penentuan tingkat SIL dibandingkan dengan model klasifikasi lainnya.=================================================================================================================================A dangerous risk can occur in an air compressor, so a security system is needed. This security system is built to be implemented on an air compressor, where this system gets a signal from the field in the form of a push button and output from a transmitter consisting of pressure, vibration, and temperature. The performance of the Safety Instrumented System (SIS) can be seen from the level of safety integration or Safety Integrity Level (SIL) when carrying out its function. The parameters to determine the SIL level are Probability Failure on Demand (PFD) and Risk Reduction Factor (RRF). Therefore, in this final project, the calculation of the Safety Integrity Level on the Safety Instrumented System Air Compressor based on the K-Nearest Neighbor (KNN) algorithm is carried out. This SIL level classification is based on the PFD and RRF values that have been calculated previously. KNN will classify data based on a similar measure or distance function. The KNN method has been proven to have a high accuracy of 100% in classifying SIL, with a proportion of training data and a testing data ratio of 80%: 20%. With a value of k=6, KNN has the highest accuracy compared to other k values. Evaluation conducted by comparing the performance of KNN with other SIL determination methods found that K-NN has advantages in terms of efficiency and accuracy. So, it can be concluded that the KNN model offers a better and practical solution for SIL determination.",tentu safety integrity level sil safety instrumented system air compressor dasar nilai probability failure on demand pfd metode knearest neighbor,resiko bahaya air compressor sistem aman sistem aman bangun implementasi air compressor mana sistem sinyal field push button output transmitter pressure vibration temperature kerja safety instrumented system sis tingkat integrasi selamat safety integrity level sil jalan fungsi parameter tingkat sil probability failure on demand pfd risk reduction factor rrf proyek hitung safety integrity level safety instrumented system air compressor dasar algoritma knearest neighbor knn klasifikasi tingkat sil dasar nilai pfd rrf hitung knn klasifikasi data dasar ukur sama fungsi jarak metode knn bukti milik akurasi 100 klasifikasi sil proporsi banding data training data testing 8020 nilai k6 knn milik akurasi tinggi banding nilai k evaluasi banding kerja knn metode tentu sil temu knn milik unggul efisiensi akurasi simpul model knn tawar solusi praktis tentu tingkat sil banding model klasifikasi lainnyaa dangerous risk can occur in an air compressor so a security system is needed this security system is built to be implemented on an air compressor where this system gets a signal from the field in the form of a push button and output from a transmitter consisting of pressure vibration and temperature the performance of the safety instrumented system sis can be seen from the level of safety integration or safety integrity level sil when carrying out its function the parameters to determine the sil level are probability failure on demand pfd and risk reduction factor rrf therefore in this final project the calculation of the safety integrity level on the safety instrumented system air compressor based on the knearest neighbor knn algorithm is carried out this sil level classification is based on the pfd and rrf values that have been calculated previously knn will classify data based on a similar measure or distance function the knn method has been proven to have a high accuracy of 100 in classifying sil with a proportion of training data and a testing data ratio of 80 20 with a value of k6 knn has the highest accuracy compared to other k values evaluation conducted by comparing the performance of knn with other sil determination methods found that knn has advantages in terms of efficiency and accuracy so it can be concluded that the knn model offers a better and practical solution for sil determination
Pengembangan Metode Rekonstruksi dan Segmentasi Citra 3D DICOM Magnetic Resonance Imaging Otak.,"Fajar, Aziz",http://repository.its.ac.id/106553/,"Saat ini operasi otak sangat bergantung pada kemampuan dokter yang melakukan operasi. Dalam melakukan operasi, dokter menggunakan citra Magnetic Resonance Imaging (MRI) berupa citra Digital Imaging and Communications in Medicine (DICOM) untuk membantu menentukan lokasi yang akan dioperasi. Hasil dari scan MRI ini adalah beberapa citra yang apabila digabungkan dapat membentuk citra 3D yang merepresentasikan otak.  Untuk melakukan pendidikan pada dokter pemula, dokter senior masih menggunakan citra 2D DICOM yang dapat membuat dokter pemula harus membayangkan bagaimana bentuk 3D dari bagian otak yang sedang dibahas. Kasus lain dimana citra 3D dibutuhkan adalah ketika melakukan segmentasi citra DICOM. Citra DICOM memiliki spacing between slices dalam metadatanya. Apabila citra DICOM memiliki space diantara slice maka ada bagian dari keseluruhan citra yang hilang. Dengan rekonstruksi 3D, bagian ini juga direkonstruksi.  Namun, membentuk 3D dari citra-citra DICOM bukan hal yang sederhana, karena apabila hanya digabungkan tanpa ada konfigurasi, maka citra yang dihasilkan tidak mirip dengan bentuk otak yang mirip dengan aslinya. Sehingga, penelitian ini mengusulkan metode untuk merekonstruksi citra 3D berdasarkan slices citra 2D DICOM. Metode rekonstruksi ini terdiri dari beberapa langkah. Metode ini terdiri dari image enhancement menggunakan histogram equalization, rekonstruksi 3D citra DICOM, interpolasi menggunakan trilinear interpolation dan resize citra 3D. Selanjutnya, dilakukan segmentasi pada citra 3D DICOM yang didapat dari dokter di Surabaya maupun BraTS 2021 sebagai dataset publik dengan menggunakan Deep Learning. Segmentasi dilakukan pada citra 3D otak karena apabila menggunakan data 2D maka struktur keseluruhan otak tidak terlihat dengan sempurna, sedangkan anatomi manusia memang sama, namun morfologi atau bentuk dari anatominya dapat berbeda-beda. Pada penelitian sebelumnya, Spatially Localized Atlas Network Tiles (SLANT) memiliki performa yang bagus, namun dalam proses training dibutuhkan sumber daya yang sangat besar dan waktu yang lama. Sedangkan, arsitektur yang digunakan adalah arsitektur Deep Learning U-Net memiliki performa yang sedikit lebih rendah namun memiliki waktu pelatihan yang jauh lebih cepat. Sehingga U-Net, Res U-Net, dan Dense U-Net termasuk arsitektur yang sering digunakan untuk segmentasi data medis  Yang terakhir, penelitian ini mengusulkan metode untuk learning rate tuning menggunakan exponential moving average dan cyclical learning rate (CLR) untuk meningkatkan hasil segmentasi. Metode ini dikembangkan berdasarkan penelitian sebelumnya. Penelitian sebelumnya melakukan learning rate test menggunakan datapoint yang didapat dari tiap akhir epoch. Sedangkan, penelitian ini menggunakan datapoint yang didapat dari tiap akhir batch pada saat proses training model. Performa dari CLR yang diusulkan ini dibandingkan dengan metode CLR pada penelitian sebelumnya.  Kinerja dari metode segmentasi dievaluasi dengan cara membandingkan hasil segmentasi dengan ground truth yang didapatkan dari dokter bedah syaraf untuk segmentasi anatomi otak. Sedangkan, metode tuning learning rate yang diusulkan dalam penelitian ini digunakan untuk segmentasi tumor pada dataset BraTS 2021 dan melakukan validasi secara online. Hal ini dilakukan untuk mengetahui performa dari metode yang diusulkan untuk tuning learning rate pada dataset publik. Untuk mengukur kemampuan dari model segmentasi, penelitian ini menggunakan Dice Similarity Coefficient (DSC).  Hasilnya, metode tuning learning rate yang disusulkan memiliki hasil yang lebih baik daripada hasil dari penelitian sebelumnya. Hasil training model pada training set menunjukkan bahwa arsitektur U-Net yang memiliki nilai DSC sebesar 81,725 % dalam 140 epochs meningkat menjadi 82% dalam 121 epochs. Arsitektur Res U-Net juga mengalami peningkatan nilai DSC dari 82,875% menjadi 83,575% namun membutuhkan jumlah epoch yang lebih banyak untuk mencapai convergence, dari 142 menjadi 152 epoch. Nilai DSC dari Dense U-Net juga meningkat dari 81,875% dalam 224 epochs menjadi 81,95% dalam 170 epochs===================================================================================================================================Currently brain surgery is very dependent on the ability of the doctor performing the operation. When carrying out surgery, doctors use Magnetic Resonance Imaging (MRI) images in the form of Digital Imaging and Communications in Medicine (DICOM) images to help determine the location to be operated on. The result of this MRI scan is several images which, when combined, can form a 3D image that represents the brain. To educate novice doctors, senior doctors still use 2D DICOM images which can make novice doctors have to imagine what the 3D shape of the part of the brain being discussed is like. Another case where 3D images are needed is when segmenting DICOM images. DICOM images have spacing between slices in their metadata. If a DICOM image has space between slices then part of the entire image is lost. With 3D reconstruction, this part is also reconstructed. However, forming 3D from DICOM images is not a simple thing, because if they are only combined without any configuration, the resulting image will not resemble the original brain shape. Thus, this research proposes a method for reconstructing 3D images based on 2D DICOM image slices. This reconstruction method consists of several steps. This method consists of image enhancement using histogram equalization, 3D reconstruction of DICOM images, interpolation using trilinear interpolation and 3D image resizing. Next, segmentation was carried out on 3D DICOM images obtained from doctors in Surabaya and BraTS 2021 as a public dataset using Deep Learning. Segmentation is carried out on 3D images of the brain because when using 2D data the overall structure of the brain cannot be seen perfectly, while human anatomy is the same, but the morphology or shape of the anatomy can vary. In previous research, Spatially Localized Atlas Network Tiles (SLANT) had good performance, but the training process required very large resources and a long time. Meanwhile, the architecture used is the U-Net Deep Learning architecture which has slightly lower performance but has a much faster training time. So U-Net, Res U-Net, and Dense U-Net are architectures that are often used for medical data segmentation. Lastly, this research proposes a method for learning rate tuning using exponential moving average and cyclical learning rate (CLR) to improve segmentation results . This method was developed based on previous research. Previous research conducted a learning rate test using data points obtained at the end of each epoch. Meanwhile, this research uses data points obtained from the end of each batch during the model training process. The performance of the proposed CLR is compared with the CLR method in previous research. The performance of the segmentation method was evaluated by comparing the segmentation results with ground truth obtained from a neurosurgeon for brain anatomical segmentation. Meanwhile, the learning rate tuning method proposed in this research is used for tumor segmentation in the BraTS 2021 dataset and carries out online validation. This was done to determine the performance of the proposed method for tuning learning rate on public datasets. To measure the ability of the segmentation model, this research uses the Dice Similarity Coefficient (DSC). As a result, the proposed learning rate tuning method has better results than the results from previous research. The results of model training on the training set show that the U-Net architecture which has a DSC value of 81.725% in 140 epochs increases to 82% in 121 epochs. The Res U-Net architecture also experienced an increase in the DSC value from 82.875% to 83.575% but required a greater number of epochs to achieve convergence, from 142 to 152 epochs. The DSC value of Dense U-Net also increased from 81.875% in 224 epochs to 81.95% in 170 epochs",kembang metode rekonstruksi segmentasi citra 3d dicom magnetic resonance imaging otak,operasi otak gantung mampu dokter operasi operasi dokter citra magnetic resonance imaging mri citra digital imaging and communications in medicine dicom bantu tentu lokasi operasi hasil scan mri citra gabung bentuk citra 3d representasi otak didik dokter mula dokter senior citra 2d dicom dokter mula bayang bentuk 3d otak bahas mana citra 3d butuh segmentasi citra dicom citra dicom milik spacing between slices metadatanya citra dicom milik space slice citra hilang rekonstruksi 3d rekonstruksi bentuk 3d citracitra dicom sederhana gabung konfigurasi citra hasil bentuk otak asli teliti usul metode rekonstruksi citra 3d dasar slices citra 2d dicom metode rekonstruksi langkah metode image enhancement histogram equalization rekonstruksi 3d citra dicom interpolasi trilinear interpolation resize citra 3d segmentasi citra 3d dicom dokter surabaya brats 2021 dataset publik deep learning segmentasi citra 3d otak data 2d struktur otak sempurna anatomi manusia morfologi bentuk anatomi berbedabeda teliti spatially localized atlas network tiles slant milik performa bagus proses training butuh sumber daya arsitektur arsitektur deep learning unet milik performa rendah milik latih cepat unet res unet dense unet arsitektur segmentasi data medis teliti usul metode learning rate tuning exponential moving average cyclical learning rate clr tingkat hasil segmentasi metode kembang dasar teliti teliti learning rate test datapoint epoch teliti datapoint batch proses training model performa clr usul banding metode clr teliti kerja metode segmentasi evaluasi banding hasil segmentasi ground truth dapat dokter bedah syaraf segmentasi anatomi otak metode tuning learning rate usul teliti segmentasi tumor dataset brats 2021 validasi online performa metode usul tuning learning rate dataset publik ukur mampu model segmentasi teliti dice similarity coefficient dsc hasil metode tuning learning rate susul milik hasil hasil teliti hasil training model training set arsitektur unet milik nilai dsc 81725 140 epochs tingkat 82 121 epochs arsitektur res unet alami tingkat nilai dsc 82875 83575 butuh epoch capai convergence 142 152 epoch nilai dsc dense unet tingkat 81875 224 epochs 8195 170 epochscurrently brain surgery is very dependent on the ability of the doctor performing the operation when carrying out surgery doctors use magnetic resonance imaging mri images in the form of digital imaging and communications in medicine dicom images to help determine the location to be operated on the result of this mri scan is several images which when combined can form a 3d image that represents the brain to educate novice doctors senior doctors still use 2d dicom images which can make novice doctors have to imagine what the 3d shape of the part of the brain being discussed is like another case where 3d images are needed is when segmenting dicom images dicom images have spacing between slices in their metadata if a dicom image has space between slices then part of the entire image is lost with 3d reconstruction this part is also reconstructed however forming 3d from dicom images is not a simple thing because if they are only combined without any configuration the resulting image will not resemble the original brain shape thus this research proposes a method for reconstructing 3d images based on 2d dicom image slices this reconstruction method consists of several steps this method consists of image enhancement using histogram equalization 3d reconstruction of dicom images interpolation using trilinear interpolation and 3d image resizing next segmentation was carried out on 3d dicom images obtained from doctors in surabaya and brats 2021 as a public dataset using deep learning segmentation is carried out on 3d images of the brain because when using 2d data the overall structure of the brain can not be seen perfectly while human anatomy is the same but the morphology or shape of the anatomy can vary in previous research spatially localized atlas network tiles slant had good performance but the training process required very large resources and a long time meanwhile the architecture used is the unet deep learning architecture which has slightly lower performance but has a much faster training time so unet res unet and dense unet are architectures that are often used for medical data segmentation lastly this research proposes a method for learning rate tuning using exponential moving average and cyclical learning rate clr to improve segmentation results this method was developed based on previous research previous research conducted a learning rate test using data points obtained at the end of each epoch meanwhile this research uses data points obtained from the end of each batch during the model training process the performance of the proposed clr is compared with the clr method in previous research the performance of the segmentation method was evaluated by comparing the segmentation results with ground truth obtained from a neurosurgeon for brain anatomical segmentation meanwhile the learning rate tuning method proposed in this research is used for tumor segmentation in the brats 2021 dataset and carries out online validation this was done to determine the performance of the proposed method for tuning learning rate on public datasets to measure the ability of the segmentation model this research uses the dice similarity coefficient dsc as a result the proposed learning rate tuning method has better results than the results from previous research the results of model training on the training set show that the unet architecture which has a dsc value of 81725 in 140 epochs increases to 82 in 121 epochs the res unet architecture also experienced an increase in the dsc value from 82875 to 83575 but required a greater number of epochs to achieve convergence from 142 to 152 epochs the dsc value of dense unet also increased from 81875 in 224 epochs to 8195 in 170 epochs
