Judul,Penulis,Link,Abstrak,Preprocessed_Judul,Preprocessed_Abstrak
Rancang Bangun Sistem Elektronik untuk Menyimak dan Mengetes Hafalan Al-Quran Berbasis Arabic Speech to Text dan Metode Levenshtein Distance.,"Muayyad, Ahmad Saad",http://repository.its.ac.id/87298/,"Al-Quran merupakan kitab suci agama Islam yang secara luas dibaca, dihafalkan, dipelajari, dan diajarkan oleh para pemeluknya. Indonesia merupakan negara dengan pemeluk agama Islam terbanyak di dunia, maka jumlah institusi dimana Al-Quran itu dihafal dan diajarkan juga sangat banyak. Berdasarkan hal tersebut, pada Tugas Akhir ini telah dibuat sebuah sistem untuk menyimak dan mengetes hafalan Al-Quran. Sistem ini menggunakan Arabic Speech-to-Text untuk mengubah input suara menjadi teks bahasa Arab, yang kemudian dibandingkan dengan data teks Al-Quran menggunakan metode Levenshtein Distance. Bila nilai perbandingan antara input dan data teks yang tersimpan melewati batas dan logika yang sudah didesain, maka sistem akan memberikan peringatan melalui output berupa suara dan tampilan visual. Sistem yang dirancang diimplementasikan menggunakan Raspberry Pi 3B+ yang dilengkapi dengan microphone, buzzer, dan Touch Screen Display. Sistem elektronik ini menggunakan data Al-Quran yang diinput secara manual dan data Al-Quran dari PyQuran sebagai rujukan. Dihasilkan persentase error sebesar 0,45% untuk penggunaan data manual dan 3,52% untuk penggunaan data PyQuran dalam pengujian 3 halaman di juz pertama Al-Quran. Latency rata-rata yang dihasilkan untuk satu kata yang diproses dengan kecepatan internet 10 Mbps adalah 0,1292 s. Kedepannya, kualitas sistem koreksi dapat ditambahkan terutama untuk PyQuran agar sistem elektronik ini dapat digunakan untuk 30 juz Al-Quran secara lengkap sehingga dapat membantu para penghafal Al-Quran =====================================================================================================Al-Quran is Islam’s Holy Book that widely recited, memorized, studied, and taught by its followers. Indonesia is a country with the largest number of Muslim, in which many intitutions where Al-Quran are memorized and taught. Based on that, in this Final Project, an electronic system for correcting and testing Al-Quran memorization was designed. This system uses Arabic Speech-to-Text to convert audio input to Arabic text that was compared to Al-Quran text data with Levenshtein Distance Method. If the comparison value between audio input and Al-Quran text data exceeds the limit and logic that has been designed, the system will give a warning by audio and visual output. This system is designed using Raspberry Pi 3B+ equipped with microphone, buzzer, and Touch Screen Display. This electronic system uses Al-Quran data that manually input and PyQuran data as its reference. An error percentage of 0,45% was obtained using Al-Quran manual data and 3,52% was obtained using PyQuran data for 3 pages from the first juz testing. Average latency that was obtained for each word processing for 10 Mbps internet speed is 0,1292 s. In the future research, the quality of correction system can be upgraded especially for PyQuran so this system can be used for 30 juz perfectly and will be a huge benefit for Al-Quran memorizer.",rancang bangun sistem elektronik simak ketes hafal alquran bas arabic speech to text metode levenshtein distance,alquran kitab suci agama islam luas baca hafal ajar ajar peluk indonesia negara peluk agama islam dunia institusi mana alquran hafal ajar dasar tugas sistem simak ketes hafal alquran sistem arabic speechtotext ubah input suara teks bahasa arab banding data teks alquran metode levenshtein distance nilai banding input data teks simpan lewat batas logika desain sistem ingat output suara tampil visual sistem rancang implementasi raspberry pi 3b lengkap microphone buzzer touch screen display sistem elektronik data alquran diinput manual data alquran pyquran rujuk hasil persentase error 045 guna data manual 352 guna data pyquran uji 3 halaman juz alquran latency ratarata hasil proses cepat internet 10 mbps 01292 s depan kualitas sistem koreksi pyquran sistem elektronik 30 juz alquran lengkap bantu hafal alquran alquran is islam  s holy book that widely recited memorized studied and taught by its followers indonesia is a country with the largest number of muslim in which many intitutions where alquran are memorized and taught based on that in this final project an electronic system for correcting and testing alquran memorization was designed this system uses arabic speechtotext to convert audio input to arabic text that was compared to alquran text data with levenshtein distance method if the comparison value between audio input and alquran text data exceeds the limit and logic that has been designed the system will give a warning by audio and visual output this system is designed using raspberry pi 3b equipped with microphone buzzer and touch screen display this electronic system uses alquran data that manually input and pyquran data as its reference an error percentage of 045 was obtained using alquran manual data and 352 was obtained using pyquran data for 3 pages from the first juz testing average latency that was obtained for each word processing for 10 mbps internet speed is 01292 s in the future research the quality of correction system can be upgraded especially for pyquran so this system can be used for 30 juz perfectly and will be a huge benefit for alquran memorizer
Prediksi Financial Distress Perusahaan Sektor Industri di Indonesia dengan Metode Klasifikasi dan Melibatkan Synthetic Features Generation.,"Muda, Muhammad Adlansyah",http://repository.its.ac.id/83474/,"Masalah kondisi financial distress dapat berakhir dengan kebangkrutan apabila tidak segera ditanggulangi. Untuk mengantisipasi dan meminimalisir dampak dari bangkrutnya suatu perusahaan terutama pada sektor industri, maka dilakukan prediksi financial distress untuk menilai kondisi keuangan perusahaan dan perspektif masa depannya. Pada penelitian ini prediksi financial distress dilakukan dengan metode klasifikasi seperti Generalized Extreme Value Regression, Logistic Regression, Support Vector Machine, dan Extreme Gradient Boosting dengan melibatkan synthetic features generation secara serentak dan seleksi variabel. Berdasarkan nilai accuracy, AUC, dan F1-score dari hasil evaluasi model menggunakan data testing didapatkan bahwa metode synthetic features generation tidak selalu memberikan performansi klasifikasi terbaik pada tiap size. Pada size 0 dan size 1 disimpulkan bahwa model Extreme Gradient Boosting dengan melibatkan synthetic features generation dan seleksi variabel merupakan model dengan performansi klasifikasi terbaik, sedangkan pada size 2 dan size 3 didapatkan bahwa model Extreme Gradient Boosting tanpa melibatkan synthetic features generation dengan seleksi variabel merupakan model dengan performansi klasifikasi terbaik dalam memprediksi kondisi keuangan perusahaan sektor industri di Indonesia.====================================================================================================================The problem of financial distress can lead to bankruptcy if it is not addressed immediately. To anticipate and minimize the impact of a company bankruptcy, especially in the industrial sector, financial distress predictions are made to assess the company’s financial condition and its future perspective. In this study, prediction of financial distress is carried out using classification methods such as Generalized Extreme Value Regression, Logistic Regression, Support Vector Machine, and Extreme Gradient Boosting by involving synthetic features generation simultaneously and variable selection. Based on the accuracy, AUC, and F1-score from the results of model evaluation using data testing, it is found that the synthetic features generation method does not always provide the best classification performance for each size. At size 0 and size 1, it can be concluded that the Extreme Gradient Boosting model involving synthetic features generation with variable selection is the model with the best classification performance, whereas at size 2 and size 3, it is found that the Extreme Gradient Boosting model without involving synthetic features generation with variabel selection is the model with the best classification performance in predicting the financial condition of industrial sector companies in Indonesia.",prediksi financial distress usaha sektor industri indonesia metode klasifikasi libat synthetic features generation,kondisi financial distress bangkrut tanggulang antisipasi meminimalisir dampak bangkrut usaha sektor industri prediksi financial distress nilai kondisi uang usaha perspektif depan teliti prediksi financial distress metode klasifikasi generalized extreme value regression logistic regression support vector machine extreme gradient boosting libat synthetic features generation serentak seleksi variabel dasar nilai accuracy auc f1score hasil evaluasi model data testing dapat metode synthetic features generation performansi klasifikasi baik size size 0 size 1 simpul model extreme gradient boosting libat synthetic features generation seleksi variabel model performansi klasifikasi baik size 2 size 3 dapat model extreme gradient boosting libat synthetic features generation seleksi variabel model performansi klasifikasi baik prediksi kondisi uang usaha sektor industri indonesiathe problem of financial distress can lead to bankruptcy if it is not addressed immediately to anticipate and minimize the impact of a company bankruptcy especially in the industrial sector financial distress predictions are made to assess the company  s financial condition and its future perspective in this study prediction of financial distress is carried out using classification methods such as generalized extreme value regression logistic regression support vector machine and extreme gradient boosting by involving synthetic features generation simultaneously and variable selection based on the accuracy auc and f1score from the results of model evaluation using data testing it is found that the synthetic features generation method does not always provide the best classification performance for each size at size 0 and size 1 it can be concluded that the extreme gradient boosting model involving synthetic features generation with variable selection is the model with the best classification performance whereas at size 2 and size 3 it is found that the extreme gradient boosting model without involving synthetic features generation with variabel selection is the model with the best classification performance in predicting the financial condition of industrial sector companies in indonesia
Secure Indoor Positioning System Model Menggunakan Serangan Boundary Attack Berbasis Aplikasi Mobile.,"Muhammad, Banabil Fawazaim",http://repository.its.ac.id/106076/,"Selama dekade terakhir, perangkat seluler telah berevolusi tidak hanya berfungsi sebagai komunikasi jarak jauh, namun juga sebagai perangkat navigasi menggunakan Global Positioning System (GPS). Karena keterbatasan GPS dalam ruangan, dikembangkan IPS (Indoor Positioning System) sebagai pengganti dari GPS pada saat di dalam ruangan.  Studi ini menyoroti kurangnya perhatian terhadap keamanan dan privasi dalam pengembangan IPS, terutama dalam menghadapi serangan keamanan seperti serangan Boundary Attack.  Penelitian ini bertujuan untuk membuat IPS yang tahan terhadap serangan Boundary Attack dengan mengembangkan model menggunakan data sidik jari Channel State Information (CSI).  Tujuan dari penelitian ini mencakup membandingkan kinerja antara model IPS dan model rekan terhadap serangan serangan perimeter, dan mengintegrasikan model dengan aplikasi seluler untuk menampilkan lokasi pengguna secara real time. Metode penelitiannya antara lain mengumpulkan dataset dari Tower 2 ITS, membangun dan melatih model IPS menggunakan data yang diserang dan tidak diserang, menerapkan serangan Boundary Attack, dan membuat aplikasi seluler terintegrasi.  Hasil penelitian meliputi evaluasi akurasi model sebelum dan sesudah serangan serta perbandingan dengan model pembanding dalam kondisi serangan. Model IPS berhasil dibangun yang dapat menahan serangan Boundary Attack dan menjaga akurasi bahkan setelah serangan tersebut. Membandingkan model IPS dengan model pembanding menunjukkan ketahanan yang baik terhadap serangan.  Dengan mengintegrasikan aplikasi mobile dengan IPS melalui Flask, pengguna dapat melihat lokasinya dengan akurasi tinggi dan real time.=================================================================================================================================Over the past decade, mobile devices have evolved to function not only as long-distance communication, but also as navigation devices using the Global Positioning System (GPS). Due to the limitations of indoor GPS, IPS (Indoor Positioning System) was developed as a replacement for GPS when indoors. This study highlights the lack of attention to security and privacy in the development of IPS, especially in the face of security attacks such as Boundary Attack. This research aims to create an IPS that is resistant to Boundary Attack by developing a model using Channel State Information (CSI) fingerprint data. The objectives of this research include comparing the performance between the IPS model and the peer model against perimeter attack attacks, and integrating the model with a mobile application to display the user's location in real time. The research methods included collecting datasets from Tower 2 ITS, building and training the IPS model using attacked and unattacked data, applying the Boundary Attack, and creating an integrated mobile application. The results include an evaluation of the accuracy of the model before and after the attack as well as a comparison with the comparison model under attack conditions. An IPS model was successfully built that can withstand Boundary Attack attacks and maintain accuracy even after such attacks. Comparing the IPS model with the comparison model shows good resistance to attacks. By integrating a mobile application with the IPS through Flask, users can view their location with high accuracy and in real time.",secure indoor positioning system model serang boundary attack bas aplikasi mobile,dekade perangkat seluler evolusi fungsi komunikasi jarak perangkat navigasi global positioning system gps batas gps ruang kembang ips indoor positioning system ganti gps ruang studi sorot kurang perhati aman privasi kembang ips hadap serang aman serang boundary attack teliti tuju ips tahan serang boundary attack kembang model data sidik jari channel state information csi tuju teliti cakup banding kerja model ips model rekan serang serang perimeter integrasi model aplikasi seluler tampil lokasi guna real time metode teliti kumpul dataset tower 2 its bangun latih model ips data serang serang terap serang boundary attack aplikasi seluler integrasi hasil teliti liput evaluasi akurasi model serang banding model banding kondisi serang model ips hasil bangun tahan serang boundary attack jaga akurasi serang banding model ips model banding tahan serang integrasi aplikasi mobile ips flask guna lokasi akurasi real timeover the past decade mobile devices have evolved to function not only as longdistance communication but also as navigation devices using the global positioning system gps due to the limitations of indoor gps ips indoor positioning system was developed as a replacement for gps when indoors this study highlights the lack of attention to security and privacy in the development of ips especially in the face of security attacks such as boundary attack this research aims to create an ips that is resistant to boundary attack by developing a model using channel state information csi fingerprint data the objectives of this research include comparing the performance between the ips model and the peer model against perimeter attack attacks and integrating the model with a mobile application to display the users location in real time the research methods included collecting datasets from tower 2 its building and training the ips model using attacked and unattacked data applying the boundary attack and creating an integrated mobile application the results include an evaluation of the accuracy of the model before and after the attack as well as a comparison with the comparison model under attack conditions an ips model was successfully built that can withstand boundary attack attacks and maintain accuracy even after such attacks comparing the ips model with the comparison model shows good resistance to attacks by integrating a mobile application with the ips through flask users can view their location with high accuracy and in real time
Sistem Informasi Pengelolaan Keuangan Sekolah (Sipks) Dengan Electronic Dan Digital Signature Recognition Menggunakan Algoritma MobileNet.,"Mukhlishah, Chaniyah Zulfa",http://repository.its.ac.id/83295/,"Pengelolaan anggaran sekolah merupakan aktivitas yang sering dilakukan di berbagai Sekolah, terutama sekolah negeri. Pengelolaan anggaran pun dapat mencakup dalam berbagai hal. Seperti kegiatan penganggaran dana akademik, organisasi, maupun administrasi yang mutlak membutuhkan alokasi dana dalam pelaksanaannya. Oleh karena itu, kegiatan pengelolaan keuangan sekolah membutuhkan perhatian, terutama dalam hal teknis pelaksanaannya agar dapat diimplementasikan lebih mudah. Pada era digital saat ini, metode penganggaran dana yang manual merupakan sebuah permasalahan dimana metode manual ini sering dikhawatirkan oleh pihak sekolah dalam hal pencatatan dan keamanannya.",sistem informasi kelola uang sekolah sipks electronic digital signature recognition algoritma mobilenet,kelola anggar sekolah aktivitas sekolah sekolah negeri kelola anggar cakup giat anggar dana akademik organisasi administrasi mutlak butuh alokasi dana laksana giat kelola uang sekolah butuh perhati teknis laksana implementasi mudah era digital metode anggar dana manual masalah mana metode manual khawatir sekolah catat aman
Aplikasi Discrete Wavelets Transform pada Analisis Regresi Spektrum Tumpang Tindih Senyawa Parasetamol dan Kafein.,"Mulyaningtias, Nadia",http://repository.its.ac.id/90046/,"Obat umumnya berisi kombinasi dari beberapa senyawa aktif. Parasetamol sering digunakan sebagai obat analgesik dan anti piretik. Kafein adalah stimulan sistem saraf pusat (SSP). Dalam pemasaran obat sakit kepala di masyarakat, pemeriksaan mutu obat diperlukan untuk menjamin bahwa obat menggandung bahan aktif dengan mutu dan jumlah sesuai dengan kandungan yang tertera pada label obat. Sehingga diperlukan metode yang efisien tanpa pemisahan, dengan bantuan spektrofotometer UV-Vis, metode Discrete Wavelets Transform dan analisis multikomponen. Sebanyak 25 larutan training set disiapkan dan dianalisis absorbansinya menggunakan metode Multiple Linier Regression, metode Support Vector Regression (SVR), metode Partial Least Square (PLS) Regression, metode AdaBoost Regression. Model yang didapat divalidasi dengan tes data sebelum diaplikasikan pada obat sakit kepala. Penentuan kadar obat yang sesuai dengan kadar dalam label obat, yaitu pada metode Support Vector Regression dimana rata-rata kadar obat prediksi parasetamol sebesar 512,5473 mg dan pada kafein sebesar 67,1091 mg. Sehingga metode berhasil digunakan untuk menetapkan kadar dalam tablet obat sakit kepala.=======================================================================================================Medicine generally contain active ingredients. Paracetamol is often used as an analgesic and anti-pyretic medicine. Caffeine is a central nervous system (CNS) stimulant. In marketing headache medicine in the community, quality inspection of medicine is needed to ensure that the medicine contains active ingredients with the quality and quantity according to the content stated on the medicine label. So an efficient method without separation is needed, with the help of a UV-Vis spectrophotometer, the Discrete Wavelets Transform method and multivariate analysis. A total of 25 training set solutions were prepared and their absorbance analyzed using the Multiple Linear Regression method, the Support Vector Regression (SVR) method, the Partial Least Square (PLS) Regression method, the AdaBoost Regression method. The model obtained was validated by testing the data before it was applied to headache medicine. Determination of medicine levels in accordance with the levels on the medicine label, namely the Support Vector Regression method where the average level of the predicted medicine parasetamol is 512.5473 mg and the caffeine is 67.1091 mg. So that the method was successfully used to determine the levels in headache medicine tablets.",aplikasi discrete wavelets transform analisis regresi spektrum tumpang tindih senyawa parasetamol kafein,obat isi kombinasi senyawa aktif parasetamol obat analgesik anti piretik kafein stimulan sistem saraf pusat ssp pasar obat sakit kepala masyarakat periksa mutu obat jamin obat gandung bahan aktif mutu sesuai kandung tera label obat metode efisien pisah bantu spektrofotometer uvvis metode discrete wavelets transform analisis multikomponen 25 larut training set siap analis absorbansinya metode multiple linier regression metode support vector regression svr metode partial least square pls regression metode adaboost regression model divalidasi tes data aplikasi obat sakit kepala tentu kadar obat sesuai kadar label obat metode support vector regression mana ratarata kadar obat prediksi parasetamol 5125473 mg kafein 671091 mg metode hasil tetap kadar tablet obat sakit kepalamedicine generally contain active ingredients paracetamol is often used as an analgesic and antipyretic medicine caffeine is a central nervous system cns stimulant in marketing headache medicine in the community quality inspection of medicine is needed to ensure that the medicine contains active ingredients with the quality and quantity according to the content stated on the medicine label so an efficient method without separation is needed with the help of a uvvis spectrophotometer the discrete wavelets transform method and multivariate analysis a total of 25 training set solutions were prepared and their absorbance analyzed using the multiple linear regression method the support vector regression svr method the partial least square pls regression method the adaboost regression method the model obtained was validated by testing the data before it was applied to headache medicine determination of medicine levels in accordance with the levels on the medicine label namely the support vector regression method where the average level of the predicted medicine parasetamol is 5125473 mg and the caffeine is 671091 mg so that the method was successfully used to determine the levels in headache medicine tablets
